Track URI,Track Name,Album Name,Artist Name(s),Release Date,Duration (ms),Popularity,Explicit,Added By,Added At,Genres,Record Label,Danceability,Energy,Key,Loudness,Mode,Speechiness,Acousticness,Instrumentalness,Liveness,Valence,Tempo,Time Signature,hit_year
spotify:track:0sf12qNH5qcw8qpgymFOqD,Blinding Lights,Blinding Lights,The Weeknd,11/29/2019,201573,22,False,nick170708!,2024-02-01T17:29:31Z,,Republic Records,0.512,0.796,1,-4.075,1,0.0645,0.00147,0.000209,0.0938,0.344,171.014,4,2020
spotify:track:0nbXyq5TXYPCO7pr3N8S4I,The Box,Please Excuse Me for Being Antisocial,Roddy Ricch,12/6/2019,196652,82,True,nick170708!,2024-02-01T17:29:31Z,melodic rap,Atlantic Records,0.896,0.586,10,-6.687,0,0.0559,0.104,0.0,0.79,0.642,116.971,4,2020
spotify:track:7igeByaBM0MgGsgXtNxDJ7,positions,positions,Ariana Grande,10/23/2020,172324,0,True,nick170708!,2024-02-01T17:29:31Z,pop,Republic Records,0.736,0.802,0,-4.759,1,0.0864,0.468,0.0,0.094,0.675,144.005,4,2020
spotify:track:696DnlkuDOXcMAnKlTgXXK,ROXANNE,ROXANNE,Arizona Zervas,10/10/2019,163636,75,True,nick170708!,2024-02-01T17:29:31Z,,Arizona Zervas,0.621,0.601,6,-5.616,0,0.148,0.0522,0.0,0.46,0.457,116.735,5,2020
spotify:track:7eJMfftS33KTjuF7lTsMCx,death bed (coffee for your head),death bed (coffee for your head),Powfu;beabadoobee,2/8/2020,173333,82,False,nick170708!,2024-02-01T17:29:31Z,bedroom pop,Columbia,0.726,0.431,8,-8.765,0,0.135,0.731,0.0,0.696,0.348,144.026,4,2020
spotify:track:4LEK9rD7TWIG4FCL1s27XC,cardigan,folklore,Taylor Swift,7/24/2020,239560,49,False,nick170708!,2024-02-01T17:29:31Z,,Taylor Swift,0.613,0.581,0,-8.588,0,0.0424,0.537,0.000345,0.25,0.551,130.033,4,2020
spotify:track:1tkg4EHVoqnhR6iFEXb60y,What You Know Bout Love,Shoot For The Stars Aim For The Moon,Pop Smoke,7/3/2020,160000,77,True,nick170708!,2024-02-01T17:29:31Z,"brooklyn drill,new york drill,drill",Victor Victor Worldwide,0.709,0.548,10,-8.493,1,0.353,0.65,1.59e-06,0.133,0.543,83.995,4,2020
spotify:track:3Dv1eDb0MEgF93GpLXlucZ,Say So,Hot Pink,Doja Cat,11/7/2019,237894,78,True,nick170708!,2024-02-01T17:29:31Z,,Kemosabe Records/RCA Records,0.787,0.673,11,-4.583,0,0.159,0.264,3.35e-06,0.0904,0.779,110.962,4,2020
spotify:track:6UelLqGlWMcVH1E5c4H7lY,Watermelon Sugar,Fine Line,Harry Styles,12/13/2019,173991,83,False,nick170708!,2024-02-01T17:29:31Z,,Columbia,0.548,0.816,0,-4.209,1,0.0465,0.122,0.0,0.335,0.557,95.39,4,2020
spotify:track:6WrI0LAC5M1Rw2MnX2ZvEg,Don't Start Now,Don't Start Now,Dua Lipa,10/31/2019,183290,73,False,nick170708!,2024-02-01T17:29:31Z,pop,Warner Records,0.794,0.793,11,-4.521,0,0.0842,0.0125,0.0,0.0952,0.677,123.941,4,2020
spotify:track:2DQNYMRjisN3KAPj1bEwOI,"Lemonade (feat. Gunna, Don Toliver & NAV)",B4 The Storm,Internet Money;Gunna;Don Toliver;NAV,8/29/2020,195428,0,True,nick170708!,2024-02-01T17:29:31Z,melodic rap,Internet Money Records/ TenThousand Projects,0.8,0.658,1,-6.142,0,0.079,0.25,0.0,0.111,0.462,140.042,4,2020
spotify:track:3ZCTVFBt2Brf31RLEnCkWJ,everything i wanted,everything i wanted,Billie Eilish,11/13/2019,245425,84,False,nick170708!,2024-02-01T17:29:31Z,,Darkroom/Interscope Records,0.704,0.225,6,-14.454,0,0.0994,0.902,0.657,0.106,0.243,120.006,4,2020
spotify:track:26XaOsDMbl0e1cVKYfkz6w,Falling,Falling,Trevor Daniel,10/5/2018,159381,70,False,nick170708!,2024-08-20T12:59:41Z,,Alamo,0.785,0.431,10,-8.756,0,0.0364,0.123,0.0,0.0887,0.236,127.085,4,2020
spotify:track:47EiUVwUp4C9fGccaPuUCS,DÁKITI,DÁKITI,Bad Bunny;JHAYCO,10/30/2020,205090,78,True,nick170708!,2024-02-01T17:29:31Z,"reggaeton,trap latino,urbano latino,latin",Rimas Entertainment LLC,0.731,0.573,4,-10.059,0,0.0544,0.401,5.22e-05,0.113,0.145,109.928,4,2020
spotify:track:7ytR5pFWmSjzHJIeQkgog4,ROCKSTAR (feat. Roddy Ricch),BLAME IT ON BABY,DaBaby;Roddy Ricch,4/17/2020,181733,74,True,nick170708!,2024-02-01T17:29:31Z,melodic rap,South Coast Music Group/Interscope Records,0.746,0.69,11,-7.956,1,0.164,0.247,0.0,0.101,0.497,89.977,4,2020
spotify:track:22LAwLoDA5b4AaGSkg6bKW,Blueberry Faygo,Certified Hitmaker,Lil Mosey,2/6/2020,162546,70,True,nick170708!,2024-02-01T17:29:31Z,melodic rap,Mogul Vision/Interscope Records,0.774,0.554,0,-7.909,1,0.0383,0.207,0.0,0.132,0.349,99.034,4,2020
spotify:track:3tjFYV6RSFtuktYl3ZtYcq,Mood (feat. iann dior),Mood (feat. iann dior),24kGoldn;iann dior,7/24/2020,140525,6,True,nick170708!,2024-02-01T17:29:31Z,melodic rap,Records/Columbia,0.7,0.722,7,-3.558,0,0.0369,0.221,0.0,0.272,0.756,90.989,4,2020
spotify:track:4Oun2ylbjFKMPTiaSbbCih,WAP (feat. Megan Thee Stallion),WAP (feat. Megan Thee Stallion),Cardi B;Megan Thee Stallion,8/7/2020,187541,75,True,nick170708!,2024-02-01T17:29:31Z,,Atlantic/KSR,0.935,0.454,1,-7.509,1,0.375,0.0194,0.0,0.0824,0.357,133.073,4,2020
spotify:track:5GkQIP5mWPi4KZLLXeuFTT,motive (with Doja Cat),Positions,Ariana Grande;Doja Cat,10/30/2020,167989,73,True,nick170708!,2024-02-01T17:29:31Z,pop,Republic Records,0.789,0.742,10,-5.664,0,0.0652,0.0681,0.0,0.166,0.661,116.965,4,2020
spotify:track:24ySl2hOPGCDcxBxFIqWBu,Rain On Me (with Ariana Grande),Rain On Me (with Ariana Grande),Lady Gaga;Ariana Grande,5/22/2020,182200,69,False,nick170708!,2024-02-01T17:29:31Z,"art pop,pop",Interscope Records,0.672,0.855,9,-3.764,1,0.0397,0.021,0.0,0.323,0.646,123.056,4,2020
spotify:track:0v1x6rN6JHRapa03JElljE,Dynamite,Dynamite,BTS,8/21/2020,199053,2,False,nick170708!,2024-02-01T17:29:31Z,k-pop,2020 BigHit Entertainment,0.746,0.765,6,-4.41,0,0.0993,0.0112,0.0,0.0936,0.737,114.044,4,2020
spotify:track:3jjujdWJ72nww5eGnfs2E7,Adore You,Fine Line,Harry Styles,12/13/2019,207139,79,False,nick170708!,2024-02-01T17:29:31Z,,Columbia,0.676,0.771,8,-3.675,1,0.0483,0.0237,7e-06,0.102,0.569,99.048,4,2020
spotify:track:1daDRI9ahBonbWD8YcxOIB,Angels Like You,Plastic Hearts,Miley Cyrus,11/27/2020,196454,82,False,nick170708!,2024-11-26T19:28:42Z,,RCA Records Label,0.672,0.642,5,-4.035,1,0.0313,0.0981,0.0,0.1,0.494,121.981,4,2020
spotify:track:3hUxzQpSfdDqwM3ZTFQY0K,august,folklore,Taylor Swift,7/24/2020,261922,85,False,nick170708!,2024-02-01T17:29:31Z,,Taylor Swift,0.532,0.623,5,-9.208,1,0.0331,0.538,7.28e-05,0.0925,0.403,89.937,4,2020
spotify:track:6jRq8gaZhMUyy5RclRPcAf,hot girl bummer,everything means nothing,blackbear,8/21/2020,188343,74,True,nick170708!,2024-02-01T17:29:31Z,,Alamo,0.782,0.559,6,-7.106,0,0.0767,0.125,0.0,0.385,0.685,129.992,1,2020
spotify:track:6bnF93Rx87YqUBLSgjiMU8,Heartless,After Hours,The Weeknd,3/20/2020,198266,78,True,nick170708!,2024-08-19T16:35:16Z,,Republic Records,0.537,0.746,10,-5.507,0,0.15,0.0236,1e-06,0.156,0.252,170.083,4,2020
spotify:track:127QTOFJsJQp5LbJbu3A1y,Toosie Slide,Toosie Slide,Drake,4/3/2020,247058,70,True,nick170708!,2024-02-01T17:29:31Z,rap,OVO,0.834,0.454,1,-9.75,0,0.201,0.321,6.15e-06,0.114,0.837,81.618,4,2020
spotify:track:5RqR4ZCCKJDcBLIn4sih9l,Party Girl,Party Girl,StaySolidRocky,4/21/2020,147800,69,True,nick170708!,2024-02-01T17:29:31Z,,Columbia,0.728,0.431,6,-9.966,0,0.0622,0.749,0.0,0.0996,0.629,130.022,4,2020
spotify:track:2b8fOow8UzyDFAE27YhOZM,Memories,Memories,Maroon 5,9/20/2019,189486,34,False,nick170708!,2024-02-01T17:29:31Z,pop,222 Records/Interscope Records,0.764,0.32,11,-7.209,1,0.0546,0.837,0.0,0.0822,0.575,91.019,4,2020
spotify:track:4HBZA5flZLE435QTztThqH,Stuck with U (with Justin Bieber),Stuck with U,Ariana Grande;Justin Bieber,5/8/2020,228482,81,False,nick170708!,2024-02-01T17:29:31Z,pop,"Ariana Grande & Justin Bieber Stuck With U""- Charity""",0.597,0.45,8,-6.658,1,0.0418,0.223,0.0,0.382,0.537,178.765,3,2020
spotify:track:4xqrdfXkTW4T0RauPLv3WA,Heather,Kid Krow,Conan Gray,3/20/2020,198040,85,False,nick170708!,2024-02-01T17:29:31Z,,Republic Records,0.357,0.425,5,-7.301,1,0.0333,0.584,0.0,0.322,0.27,102.078,3,2020
spotify:track:4umIPjkehX1r7uhmGvXiSV,Intentions (feat. Quavo),Changes,Justin Bieber;Quavo,2/14/2020,212866,76,False,nick170708!,2024-02-01T17:29:31Z,,RBMG/Def Jam,0.806,0.546,9,-6.637,1,0.0579,0.298,0.0,0.102,0.875,147.988,4,2020
spotify:track:3VyjsVV24RmBIbWJAeUJNu,No Idea,No Idea,Don Toliver,5/29/2019,154424,0,False,nick170708!,2024-09-17T16:09:55Z,,Cactus Jack / Atlantic,0.651,0.631,6,-5.717,0,0.0896,0.519,0.000579,0.165,0.35,127.994,4,2020
spotify:track:5yY9lUy8nbvjM1Uyo1Uqoc,Life Is Good (feat. Drake),Life Is Good (feat. Drake),Future;Drake,1/10/2020,237735,72,True,nick170708!,2024-02-01T17:29:31Z,rap,Epic/Freebandz,0.676,0.609,2,-5.831,0,0.481,0.0706,0.0,0.152,0.508,142.037,4,2020
spotify:track:3eekarcy7kvN4yt5ZFzltW,HIGHEST IN THE ROOM,HIGHEST IN THE ROOM,Travis Scott,10/4/2019,175720,83,True,nick170708!,2024-02-01T17:29:31Z,rap,Cactus Jack/Epic,0.598,0.427,7,-8.764,0,0.0317,0.0546,5.83e-06,0.21,0.0605,76.469,4,2020
spotify:track:0PvFJmanyNQMseIFrU708S,For The Night (feat. Lil Baby & DaBaby),Shoot For The Stars Aim For The Moon,Pop Smoke;Lil Baby;DaBaby,7/3/2020,190476,75,True,nick170708!,2024-02-01T17:29:31Z,"brooklyn drill,new york drill,drill",Victor Victor Worldwide,0.823,0.586,6,-6.606,0,0.2,0.114,0.0,0.193,0.347,125.971,4,2020
spotify:track:5hM5arv9KDbCHS0k9uqwjr,Borderline,The Slow Rush,Tame Impala,2/14/2020,237800,85,False,nick170708!,2025-10-25T14:55:38Z,"neo-psychedelic,indie",Universal Music Australia Pty. Ltd.,0.621,0.873,5,-3.067,0,0.0369,0.0406,9.1e-06,0.0824,0.873,97.96,4,2020
spotify:track:2Wo6QQD1KMDWeFkkjLqwx5,Roses - Imanbek Remix,Roses (Imanbek Remix),SAINt JHN;Imanbek,9/13/2019,176218,8,True,nick170708!,2024-02-01T17:29:31Z,slap house,HITCO,0.785,0.721,8,-5.457,1,0.0506,0.0149,0.00432,0.285,0.894,121.962,4,2020
spotify:track:45bE4HXI0AwGZXfZtMp8JR,you broke me first,you broke me first,Tate McRae,4/17/2020,169265,5,True,nick170708!,2024-02-01T17:29:31Z,,RCA Records Label,0.667,0.373,4,-9.389,1,0.05,0.785,0.0,0.0906,0.0823,124.148,4,2020
spotify:track:3GZoWLVbmxcBys6g0DLFLf,Supalonely (feat. Gus Dapperton),Hey u x,BENEE;Gus Dapperton,11/13/2020,223488,60,True,nick170708!,2024-02-01T17:29:31Z,bedroom pop,Republic Records,0.862,0.631,7,-4.746,1,0.0515,0.291,0.000209,0.123,0.841,128.978,4,2020
spotify:track:1Cv1YLb4q0RzL6pybtaMLo,Sunday Best,Where the Light Is,Surfaces,1/6/2019,158571,5,False,nick170708!,2024-02-01T17:29:31Z,,"Surfaces, LLC / TenThousand Projects, LLC",0.878,0.525,5,-6.832,1,0.0578,0.183,0.0,0.0714,0.694,112.022,4,2020
spotify:track:3hxIUxnT27p5WcmjGUXNwx,Shut up My Moms Calling,Shut up My Moms Calling,Hotel Ugly,2/10/2020,164571,87,False,nick170708!,2024-11-26T19:26:57Z,,"Hotel Ugly, under exclusive license to Amuseio AB",0.485,0.409,9,-10.711,0,0.101,0.325,0.0,0.103,0.376,138.419,4,2020
spotify:track:41L3O37CECZt3N7ziG2z7l,Yummy,Yummy,Justin Bieber,1/3/2020,210426,65,False,nick170708!,2024-02-01T17:29:31Z,,RBMG/Def Jam,0.688,0.514,9,-6.612,0,0.0903,0.366,0.0,0.116,0.494,145.919,4,2020
spotify:track:5v4GgrXPMghOnBBLmveLac,Savage Remix (feat. Beyoncé),Savage Remix (feat. Beyoncé),Megan Thee Stallion;Beyoncé,4/29/2020,242000,59,True,nick170708!,2024-02-01T17:29:31Z,,300 Entertainment,0.822,0.743,10,-4.772,0,0.28,0.016,0.0,0.127,0.636,84.459,4,2020
spotify:track:3vAn0qZzdyuHamcrpkfiX3,How You Like That,How You Like That,BLACKPINK,6/26/2020,181263,1,False,nick170708!,2024-02-01T17:29:31Z,k-pop,YG Entertainment/Interscope Records,0.828,0.782,11,-4.014,1,0.0918,0.0694,3.41e-05,0.0544,0.351,130.013,4,2020
spotify:track:1raaNykBg1bDnWENUiglUA,Break My Heart,Break My Heart,Dua Lipa,3/25/2020,221820,59,False,nick170708!,2025-01-11T21:58:35Z,pop,Warner Records,0.73,0.729,4,-3.434,0,0.0886,0.167,1.39e-06,0.349,0.467,113.012,4,2020
spotify:track:7k4t7uLgtOxPwTpFmtJNTY,Tusa,Tusa,KAROL G;Nicki Minaj,11/7/2019,200960,73,True,nick170708!,2024-02-01T17:29:31Z,"reggaeton,latin,urbano latino",TUSA - Karol G & Nicki Minaj,0.803,0.715,2,-3.28,1,0.298,0.295,0.000134,0.0574,0.574,101.085,4,2020
spotify:track:1yoMvmasuxZfqHEipJhRbp,Hawái,PAPI JUANCHO,Maluma,8/21/2020,199112,79,False,nick170708!,2024-02-01T17:29:31Z,"reggaeton,latin,urbano latino",Sony Music Latin,0.783,0.727,6,-3.454,0,0.389,0.185,2.46e-05,0.0626,0.558,180.067,4,2020
spotify:track:0EhpEsp4L0oRGM0vmeaN5e,UN DIA (ONE DAY) (Feat. Tainy),UN DIA (ONE DAY) (Feat. Tainy),J Balvin;Dua Lipa;Bad Bunny;Tainy,7/24/2020,232253,70,False,nick170708!,2024-02-01T17:29:31Z,"reggaeton,latin,pop,trap latino,urbano latino",Universal Music Latino/ NEON16,0.571,0.693,6,-8.234,0,0.0545,0.00536,0.0,0.173,0.393,168.169,4,2020
spotify:track:2Z8yfpFX0ZMavHkcIeHiO1,Monster (Shawn Mendes & Justin Bieber),Monster,Shawn Mendes;Justin Bieber,11/20/2020,178994,67,False,nick170708!,2024-02-01T17:29:31Z,,Shawn Mendes LP4-5 PS/ Island,0.652,0.383,2,-7.076,0,0.0516,0.0676,0.0,0.0828,0.549,145.765,4,2020
spotify:track:6J2LdBN97cDWn0MLxYh9HB,July,THE END OF EVERYTHING,Noah Cyrus,5/15/2020,156106,79,False,nick170708!,2024-02-01T17:29:31Z,,Records/Columbia,0.708,0.186,9,-8.953,0,0.042,0.868,0.0,0.0779,0.322,72.541,4,2020
spotify:track:4pvb0WLRcMtbPGmtejJJ6y,exile (feat. Bon Iver),folklore,Taylor Swift;Bon Iver,7/24/2020,285634,80,False,nick170708!,2025-06-30T01:59:39Z,,Taylor Swift,0.298,0.38,6,-8.426,1,0.0287,0.778,5.62e-05,0.11,0.152,75.602,4,2020
spotify:track:2gMXnyrvIjhVBUZwvLZDMP,Before You Go,Divinely Uninspired To A Hellish Extent (Extended Edition),Lewis Capaldi,11/22/2019,215106,84,False,nick170708!,2024-02-01T17:29:31Z,soft pop,Vertigo Berlin,0.459,0.574,3,-4.857,1,0.0577,0.608,0.0,0.0885,0.183,111.881,4,2020
spotify:track:2SAqBLGA283SUiwJ3xOUVI,Laugh Now Cry Later (feat. Lil Durk),Laugh Now Cry Later (feat. Lil Durk),Drake;Lil Durk,8/14/2020,261492,76,True,nick170708!,2024-02-01T17:29:31Z,"rap,chicago drill,drill",OVO,0.761,0.518,0,-8.871,1,0.134,0.244,3.47e-05,0.107,0.522,133.976,4,2020
spotify:track:7FIWs0pqAYbP91WWM0vlTQ,Godzilla (feat. Juice WRLD),Music To Be Murdered By,Eminem;Juice WRLD,1/17/2020,210800,81,True,nick170708!,2024-02-01T17:29:31Z,"rap,hip hop,melodic rap,emo rap",Shady/Aftermath/Interscope Records,0.808,0.745,10,-5.26,0,0.342,0.145,0.0,0.292,0.829,165.995,4,2020
spotify:track:78qd8dvwea0Gosb6Fe6j3k,Boss Bitch,Boss Bitch,Doja Cat,1/23/2020,134239,74,False,nick170708!,2024-02-01T17:29:31Z,,Atlantic Records,0.707,0.955,10,-4.593,0,0.222,0.127,0.0,0.202,0.575,125.989,4,2020
spotify:track:29TPjc8wxfz4XMn21O7VsZ,Sky,Whole Lotta Red,Playboi Carti,12/25/2020,193234,79,True,nick170708!,2025-01-20T21:27:08Z,rage rap,AWGE/Interscope Records,0.785,0.903,2,-4.184,1,0.21,0.258,0.0,0.169,0.565,139.98,4,2020
spotify:track:2p8IUWQDrpjuFltbdgLOag,After Hours,After Hours,The Weeknd,3/20/2020,361026,82,False,nick170708!,2024-12-04T12:54:29Z,,Republic Records,0.658,0.572,5,-6.099,0,0.0308,0.0811,0.0061,0.121,0.144,108.968,4,2020
spotify:track:2kJwzbxV2ppxnQoYw4GLBZ,If the World Was Ending (feat. Julia Michaels),If the World Was Ending (feat. Julia Michaels),JP Saxe;Julia Michaels,10/17/2019,208687,74,False,nick170708!,2024-02-01T17:29:31Z,,Arista Records,0.464,0.473,1,-10.086,1,0.129,0.866,0.0,0.109,0.604,75.801,4,2020
spotify:track:6NfrH0ANGmgBXyxgV2PeXt,La Difícil,YHLQMDLG,Bad Bunny,2/29/2020,163084,72,True,nick170708!,2024-02-01T17:29:31Z,"reggaeton,trap latino,urbano latino,latin",Rimas Entertainment LLC,0.685,0.848,8,-4.561,0,0.0858,0.0861,7.14e-06,0.0783,0.761,179.87,4,2020
spotify:track:2MbdDtCv5LUVjYy9RuGTgC,"WHATS POPPIN (feat. DaBaby, Tory Lanez & Lil Wayne) - Remix","WHATS POPPIN (feat. DaBaby, Tory Lanez & Lil Wayne) [Remix]",Jack Harlow;Tory Lanez;DaBaby;Lil Wayne,6/24/2020,227478,65,True,nick170708!,2024-02-01T17:29:31Z,"rap,hip hop",Generation Now/Atlantic,0.904,0.723,11,-5.224,0,0.26,0.0631,0.0,0.185,0.835,145.013,4,2020
spotify:track:7szuecWAPwGoV1e5vGu8tl,In Your Eyes,After Hours,The Weeknd,3/20/2020,237520,77,True,nick170708!,2024-02-01T17:29:31Z,,Republic Records,0.667,0.719,7,-5.371,0,0.0346,0.0028,7.92e-05,0.0736,0.718,100.019,4,2020
spotify:track:6o3QUC5oAE4g6WxRIFcZtb,Wishing Well,Legends Never Die,Juice WRLD,7/10/2020,194621,1,True,nick170708!,2024-02-01T17:29:31Z,"melodic rap,emo rap",Grade A Productions/Interscope Records,0.65,0.613,9,-6.13,0,0.128,0.00336,0.0,0.267,0.0804,149.972,4,2020
spotify:track:5JqZ3oqF00jkT81foAFvqg,Prisoner (feat. Dua Lipa),Prisoner (feat. Dua Lipa),Miley Cyrus;Dua Lipa,11/20/2020,169333,1,False,nick170708!,2024-02-01T17:29:31Z,pop,RCA Records Label,0.781,0.67,3,-3.912,0,0.0452,0.0103,0.0,0.0761,0.595,127.99,4,2020
spotify:track:6KfoDhO4XUWSbnyKjNp9c4,Maniac,Kid Krow,Conan Gray,3/20/2020,185773,76,False,nick170708!,2025-05-24T20:10:26Z,,Republic Records,0.628,0.639,8,-5.46,1,0.0435,0.00162,0.0,0.354,0.493,108.045,4,2020
spotify:track:45S5WTQEGOB1VHr1Q4FuPl,Golden,Fine Line,Harry Styles,12/13/2019,208917,74,False,nick170708!,2024-09-17T16:08:51Z,,Columbia,0.448,0.838,4,-5.257,0,0.0557,0.21,0.000131,0.131,0.254,139.863,4,2020
spotify:track:4Lxseh0wN7N0ljiOh8KwbU,Come & Go (with Marshmello),Come & Go (with Marshmello),Juice WRLD;Marshmello,7/9/2020,205484,55,True,nick170708!,2024-02-01T17:29:31Z,"melodic rap,emo rap,edm",Joytime Collective/Grade A Productions/Interscope Records,0.625,0.811,0,-5.183,1,0.0659,0.0173,0.0,0.16,0.532,144.994,4,2020
spotify:track:7a53HqqArd4b9NF4XAmlbI,Kings & Queens,Heaven & Hell,Ava Max,9/18/2020,162398,82,False,nick170708!,2025-01-07T22:12:49Z,,Atlantic Records,0.637,0.69,1,-4.057,0,0.0405,0.00786,0.0,0.124,0.457,129.857,4,2020
spotify:track:2J4P46vCFm1rPkNkp9pZWX,Ice Cream (with Selena Gomez),Ice Cream (with Selena Gomez),BLACKPINK;Selena Gomez,8/28/2020,175813,62,False,nick170708!,2024-02-01T17:29:31Z,k-pop,YG Entertainment/Interscope Records,0.79,0.729,9,-3.843,1,0.334,0.0342,9.31e-05,0.0411,0.904,159.989,4,2020
spotify:track:62aP9fBQKYKxi7PDXwcUAS,ily (i love you baby) (feat. Emilee),ily (i love you baby) (feat. Emilee),Surf Mesa;Emilee,11/26/2019,176546,74,False,nick170708!,2024-02-01T17:29:31Z,,Astralwerks,0.674,0.774,11,-7.567,0,0.0892,0.0686,0.00188,0.393,0.33,112.05,4,2020
spotify:track:3H7ihDc1dqLriiWXwsc2po,Breaking Me,Breaking Me,Topic;A7S,12/19/2019,166793,72,False,nick170708!,2024-02-01T17:29:31Z,,Intercord,0.789,0.72,8,-5.652,0,0.218,0.223,0.0,0.129,0.664,122.031,4,2020
spotify:track:3Z8FwOEN59mRMxDCtb8N0A,Be Kind (with Halsey),Be Kind (with Halsey),Marshmello;Halsey,5/1/2020,172761,72,False,nick170708!,2024-02-01T17:29:31Z,edm,Astralwerks,0.63,0.633,4,-7.088,1,0.0457,0.00776,0.0,0.0541,0.452,93.992,4,2020
spotify:track:1DWZUa5Mzf2BwzpHtgbHPY,Good News,Circles,Mac Miller,1/17/2020,342040,70,False,nick170708!,2024-02-01T17:29:31Z,,Warner Records,0.794,0.32,1,-12.92,0,0.173,0.853,0.134,0.112,0.241,174.088,4,2020
spotify:track:54bFM56PmE4YLRnqpW6Tha,Therefore I Am,Therefore I Am,Billie Eilish,11/12/2020,174321,69,False,nick170708!,2024-02-01T17:29:31Z,,Darkroom/Interscope Records,0.889,0.34,11,-7.773,0,0.0697,0.218,0.13,0.055,0.716,94.009,4,2020
spotify:track:7HMmFQsKsljwTw8bS7lu19,Rare,Rare,Selena Gomez,1/10/2020,220589,58,False,nick170708!,2024-02-01T17:29:31Z,,Interscope Records,0.838,0.541,5,-6.746,1,0.0708,0.207,7.97e-05,0.103,0.637,114.996,4,2020
spotify:track:6AGOKlMZWLCaEJGnaROtF9,Put Your Records On,Put Your Records On,Ritt Momney,4/24/2020,210463,68,False,nick170708!,2024-02-01T17:29:31Z,bedroom pop,Columbia,0.399,0.491,6,-10.778,0,0.0538,0.0563,0.00089,0.11,0.151,91.066,4,2020
spotify:track:5u1n1kITHCxxp8twBcZxWy,Holy (feat. Chance The Rapper),Holy,Justin Bieber;Chance the Rapper,9/18/2020,212093,67,False,nick170708!,2024-02-01T17:29:31Z,,RBMG/Def Jam,0.673,0.704,6,-8.056,1,0.36,0.196,0.0,0.0898,0.372,86.919,4,2020
spotify:track:5KCbr5ndeby4y4ggthdiAb,Wonder,Wonder,Shawn Mendes,10/2/2020,172692,66,False,nick170708!,2024-02-01T17:29:31Z,,Shawn Mendes LP4-5 PS/ Island,0.333,0.637,1,-4.904,0,0.0581,0.131,1.8e-05,0.149,0.132,139.898,4,2020
spotify:track:1xQ6trAsedVPCdbtDAmk0c,Savage Love (Laxed - Siren Beat),Savage Love (Laxed - Siren Beat),Jawsh 685;Jason Derulo,6/11/2020,171374,71,True,nick170708!,2024-02-01T17:29:31Z,,Columbia,0.767,0.481,0,-8.52,0,0.0803,0.234,0.0,0.269,0.761,150.076,4,2020
spotify:track:70rFIfYN7lU6iTgUIVP42w,my ex's best friend (with blackbear),my ex's best friend (with blackbear),mgk;blackbear,8/7/2020,138970,1,True,nick170708!,2024-02-01T17:29:31Z,,Bad Boy/Interscope Records,0.728,0.685,5,-5.096,0,0.0433,0.00391,0.0,0.152,0.33,124.934,4,2020
spotify:track:27ycaQnQAxaPiyeg3nr2aB,Midnight Sky,Midnight Sky,Miley Cyrus,8/14/2020,223279,3,False,nick170708!,2024-02-01T17:29:31Z,,RCA Records Label,0.705,0.814,4,-5.466,0,0.0346,0.00115,0.00312,0.203,0.259,110.0,4,2020
spotify:track:1KixkQVDUHggZMU9dUobgm,My Head & My Heart,Heaven & Hell,Ava Max,9/18/2020,174760,73,False,nick170708!,2025-01-07T22:13:18Z,,Atlantic Records,0.614,0.934,9,-3.709,0,0.07,0.0697,0.0,0.121,0.436,116.001,4,2020
spotify:track:4NCsrTzgVfsDo8nWyP8PPc,RITMO (Bad Boys For Life),Translation,Black Eyed Peas;J Balvin,6/18/2020,214934,48,True,nick170708!,2024-02-01T17:29:31Z,"reggaeton,latin",Universal Music Division Polydor France,0.723,0.704,10,-7.088,0,0.0571,0.0259,0.00109,0.792,0.684,105.095,4,2020
spotify:track:6EDO9iiTtwNv6waLwa1UUq,POPSTAR (feat. Drake),POPSTAR (feat. Drake),DJ Khaled;Drake,7/17/2020,200221,67,True,nick170708!,2024-02-01T17:29:31Z,rap,OVO/We The Best/Epic,0.8,0.56,5,-4.818,0,0.261,0.057,0.0,0.134,0.45,163.071,4,2020
spotify:track:39Yp9wwQiSRIDOvrVg7mbk,THE SCOTTS,THE SCOTTS,THE SCOTTS;Travis Scott;Kid Cudi,4/24/2020,165977,70,True,nick170708!,2024-02-01T17:29:31Z,rap,Cactus Jack / Epic,0.716,0.537,0,-7.648,0,0.0514,0.233,0.0,0.157,0.28,129.979,4,2020
spotify:track:07KXEDMj78x68D884wgVEm,High Fashion (feat. Mustard),Please Excuse Me for Being Antisocial,Roddy Ricch;Mustard,12/6/2019,220486,70,True,nick170708!,2024-02-01T17:29:31Z,melodic rap,Atlantic Records,0.831,0.499,11,-8.442,0,0.114,0.269,0.0,0.3,0.511,97.956,4,2020
spotify:track:2DEZmgHKAvm41k4J3R2E9Y,Safaera,YHLQMDLG,Bad Bunny;Jowell & Randy;Ñengo Flow,2/29/2020,295176,77,True,nick170708!,2024-02-01T17:29:31Z,"reggaeton,trap latino,urbano latino,latin",Rimas Entertainment LLC,0.607,0.829,2,-4.074,1,0.379,0.0103,0.0,0.107,0.685,96.172,4,2020
spotify:track:3AzjcOeAmA57TIOr9zF1ZW,Physical,Future Nostalgia,Dua Lipa,3/27/2020,193829,76,False,nick170708!,2024-02-01T17:29:31Z,pop,Warner Records,0.647,0.844,0,-3.756,1,0.0457,0.0137,0.000658,0.102,0.746,146.967,4,2020
spotify:track:6cx06DFPPHchuUAcTxznu9,Head & Heart (feat. MNEK),Head & Heart (feat. MNEK),Joel Corry;MNEK,7/3/2020,166028,75,False,nick170708!,2024-02-01T17:29:31Z,dance pop,Atlantic Records UK,0.734,0.874,8,-3.158,1,0.0662,0.168,1.14e-05,0.0489,0.905,122.953,4,2020
spotify:track:7lidXGPXPYLNThITAOTlkK,You should be sad,Manic,Halsey,1/17/2020,205473,68,True,nick170708!,2024-02-01T17:29:31Z,,Capitol Records,0.591,0.585,2,-6.35,1,0.0276,0.143,0.0,0.109,0.323,110.943,4,2020
spotify:track:73SpzrcaHk0RQPFP73vqVR,No Time To Die,No Time To Die,Billie Eilish,2/13/2020,242265,77,False,nick170708!,2024-02-01T17:29:31Z,,Darkroom/Interscope Records,0.344,0.22,4,-13.218,0,0.0365,0.917,0.0107,0.0827,0.0522,70.895,4,2020
spotify:track:4y4spB9m0Q6026KfkAvy9Q,Lonely (with benny blanco),Lonely (with benny blanco),Justin Bieber;benny blanco,10/16/2020,149297,67,True,nick170708!,2024-02-01T17:29:31Z,,Friends Keep Secrets/Def Jam Recordings/Interscope Records,0.631,0.239,11,-7.071,0,0.0398,0.864,0.0,0.116,0.0927,79.859,4,2020
spotify:track:2ygvZOXrIeVL4xZmAWJT2C,my future,my future,Billie Eilish,7/30/2020,208155,68,False,nick170708!,2024-02-01T17:29:31Z,,Darkroom/Interscope Records,0.444,0.309,8,-10.956,1,0.062,0.795,0.132,0.352,0.0875,104.745,4,2020
spotify:track:2nC3QhMI9reBIOWutbU3Tj,Moral of the Story,Moral of the Story,Ashe,2/14/2019,201083,73,True,nick170708!,2024-02-01T17:29:31Z,,Mom+Pop,0.572,0.406,10,-8.624,1,0.0427,0.587,4.48e-06,0.102,0.265,119.812,4,2020
spotify:track:4HDCLYli2SUdkq9OjmvhSD,BELIEVE IT,PARTYMOBILE,PARTYNEXTDOOR;Rihanna,3/27/2020,183219,0,True,nick170708!,2024-02-01T17:29:31Z,"dark r&b,r&b,trap soul",OVO Sound/Warner Records,0.43,0.7,6,-5.35,1,0.264,0.0902,0.0,0.216,0.731,158.373,4,2020
spotify:track:6xZ4Q2k2ompmDppyeESIY8,Level of Concern,Level of Concern,Twenty One Pilots,4/9/2020,220051,63,False,nick170708!,2024-02-01T17:29:31Z,,Fueled By Ramen,0.754,0.583,4,-7.34,0,0.0432,0.32,0.00015,0.144,0.77,122.012,4,2020
spotify:track:3IB5qOeMayvpOdHxYCL5tZ,ON (Feat. Sia),MAP OF THE SOUL : 7,BTS;Sia,2/21/2020,246816,0,False,nick170708!,2024-02-01T17:29:31Z,k-pop,BIGHIT MUSIC / HYBE,0.591,0.848,9,-4.397,0,0.0828,0.137,0.0,0.372,0.386,105.922,4,2020
spotify:track:4w47S36wQGBhGg073q3nt7,TKN (feat. Travis Scott),TKN (feat. Travis Scott),ROSALÍA;Travis Scott,5/28/2020,129370,67,False,nick170708!,2024-02-01T17:29:31Z,"latin,rap",Columbia,0.776,0.509,0,-6.266,0,0.467,0.192,1.49e-06,0.115,0.485,94.634,4,2020
spotify:track:1IIKrJVP1C9N7iPtG6eOsK,Go Crazy,Slime & B,Chris Brown;Young Thug,5/8/2020,176960,78,True,nick170708!,2024-02-01T17:29:31Z,"r&b,rap,melodic rap,trap",Chris Brown Entertainment/300 Entertainment/RCA Records,0.755,0.578,0,-8.932,0,0.145,0.316,0.0,0.25,0.581,94.148,4,2020
spotify:track:4wNIkl5XGiAACjFBlDWuSd,What A Man Gotta Do,What A Man Gotta Do,Jonas Brothers,1/17/2020,180644,70,False,nick170708!,2024-02-01T17:29:31Z,,Republic Records,0.853,0.696,9,-7.206,1,0.0633,0.00852,1e-06,0.0773,0.324,113.026,4,2020
spotify:track:4DpNNXFMMxQEKl7r0ykkWA,Play Date,Cry Baby (Deluxe Edition),Melanie Martinez,8/14/2015,179867,75,True,nick170708!,2024-02-01T17:29:31Z,,Atlantic Records,0.68,0.729,5,-5.077,1,0.0475,0.612,0.0,0.224,0.446,123.97,4,2020
spotify:track:59qrUpoplZxbIZxk6X0Bm3,Take You Dancing,Take You Dancing,Jason Derulo,7/22/2020,190306,71,False,nick170708!,2024-02-01T17:29:31Z,,Atlantic Records,0.789,0.711,2,-4.248,1,0.041,0.0332,0.0,0.0876,0.753,112.985,4,2020
spotify:track:14wf185UxfNbSy8dwt4r4q,MAMACITA,MAMACITA,Black Eyed Peas;Ozuna;J. Rey Soul,4/10/2020,249142,61,True,nick170708!,2024-02-01T17:29:31Z,"reggaeton,trap latino,latin,urbano latino",Epic,0.894,0.635,2,-6.929,1,0.0473,0.193,0.00105,0.0823,0.428,105.013,4,2020
spotify:track:5SWnsxjhdcEDc7LJjq9UHk,Runnin,SAVAGE MODE II,21 Savage;Metro Boomin,10/2/2020,195906,76,True,nick170708!,2024-02-01T17:29:31Z,,"Slaughter Gang, LLC/Epic/Boominati Worldwide/Republic",0.819,0.626,10,-4.574,0,0.202,0.00748,0.101,0.167,0.415,143.01,4,2020
spotify:track:6AzKhCHOms83jvNVLsz0Bt,Djadja (feat. Maluma) - Remix,Djadja (feat. Maluma) [Remix],Aya Nakamura;Maluma,6/12/2020,166850,60,False,nick170708!,2024-02-01T17:29:31Z,"french r&b,pop urbaine,reggaeton,latin,urbano latino",Rec. 118,0.791,0.682,5,-7.328,1,0.158,0.175,0.0,0.0926,0.672,98.031,4,2020
spotify:track:3yOlyBJuViE2YSGn3nVE1K,My Oh My (feat. DaBaby),Romance,Camila Cabello;DaBaby,12/6/2019,171375,76,False,nick170708!,2024-02-01T17:29:31Z,,Syco Music/Epic,0.724,0.491,8,-6.024,1,0.0296,0.018,1.29e-05,0.0887,0.383,105.046,4,2020
spotify:track:7Bar1kLTmsRmH6FCKKMEyU,Hit Different,Hit Different,SZA;The Neptunes;Pharrell Williams;Ty Dolla $ign,9/4/2020,202007,67,True,nick170708!,2025-02-11T17:00:32Z,"r&b,trap soul",Top Dawg Entertainment/RCA Records,0.679,0.516,0,-6.371,0,0.0452,0.199,0.0,0.0965,0.716,120.074,4,2020
spotify:track:3kwgqoBqTwoAH4nT29TYrq,Nobody's Love,Nobody's Love,Maroon 5,7/24/2020,211253,10,False,nick170708!,2025-07-01T21:37:42Z,pop,222 Records/Interscope Records,0.486,0.567,1,-6.456,1,0.0379,0.31,0.0,0.0949,0.154,93.68,4,2020
spotify:track:1dLXLETYiZohIZWnse4ypG,Better,Better,ZAYN,9/25/2020,174516,49,False,nick170708!,2025-07-01T21:37:47Z,,RCA Records Label,0.637,0.418,2,-7.137,1,0.301,0.353,0.0,0.131,0.0807,84.295,4,2020
spotify:track:58AGoOGbwsQMhBbH0eFLRR,Over Now (with The Weeknd),Over Now (with The Weeknd),Calvin Harris;The Weeknd,8/28/2020,210795,62,True,nick170708!,2025-07-01T21:37:51Z,edm,Columbia,0.612,0.884,4,-4.113,0,0.0454,0.0759,0.00132,0.247,0.679,178.043,4,2020
spotify:track:7xbWAw3LMgRMn4omR5yVn3,Lose Somebody,Lose Somebody,Kygo;OneRepublic,5/15/2020,199549,60,False,nick170708!,2025-07-01T21:37:55Z,"tropical house,soft pop",Kygo,0.58,0.586,1,-6.883,1,0.0357,0.344,0.0,0.0755,0.507,147.988,4,2020
spotify:track:0zzVTGyRrWpQu8Fr28NRAv,OK Not To Be OK,OK Not To Be OK,Marshmello;Demi Lovato,9/10/2020,159862,61,False,nick170708!,2025-07-01T21:37:58Z,edm,Joytime Collective,0.743,0.837,1,-5.025,0,0.0649,0.0172,0.0,0.0743,0.263,103.072,4,2020
spotify:track:4uqh9bualXNHXXwO2wPorc,Daisies,Daisies,Katy Perry,5/15/2020,173123,56,False,nick170708!,2025-07-01T21:38:03Z,pop,Capitol Records,0.639,0.546,1,-5.382,1,0.0407,0.0837,0.0,0.122,0.149,122.179,4,2020
spotify:track:7aGyRfJWtLqgJaZoG9lJhE,Mad at Disney,Mad at Disney,salem ilese,7/24/2020,136838,0,False,nick170708!,2025-07-01T21:38:14Z,,"Homemade Projects, LLC / TenThousand Projects",0.738,0.621,0,-7.313,1,0.0486,0.424,7.39e-06,0.692,0.715,113.968,4,2020
spotify:track:0jT8Nl0shPS8115is0wD2Q,Favorito,Por Primera Vez,Camilo,4/17/2020,209765,71,False,nick170708!,2025-07-01T21:38:18Z,"colombian pop,pop urbano",Sony Music Latin,0.606,0.853,9,-2.975,1,0.0545,0.237,0.0,0.251,0.822,178.043,4,2020
spotify:track:4POHzEwNTCYaIvqCUp3NnO,Old Me,CALM,5 Seconds of Summer,3/27/2020,186785,0,True,nick170708!,2025-07-01T21:38:25Z,,5 Seconds Of Summer/Interscope,0.721,0.62,0,-3.639,1,0.0483,0.313,0.0,0.26,0.473,127.979,4,2020
spotify:track:2IHLaN6wwYKQ3S24NsQqpA,I Love Me,I Love Me,Demi Lovato,3/6/2020,203672,52,True,nick170708!,2025-07-01T21:38:28Z,,Island Records,0.664,0.561,6,-7.031,1,0.0495,0.00261,0.0,0.0764,0.713,150.093,4,2020
spotify:track:7x4ASXYEKfQBCewcZhK776,"Ay, DiOs Mío!","Ay, DiOs Mío!",KAROL G,7/10/2020,189653,63,False,nick170708!,2025-07-01T21:38:39Z,"reggaeton,latin,urbano latino",UMLE - Latino,0.718,0.712,11,-4.366,1,0.174,0.512,0.00121,0.104,0.531,180.034,4,2020
spotify:track:35RJhm1pEovTBwnNR0zWad,GREECE (feat. Drake),GREECE (feat. Drake),DJ Khaled;Drake,7/16/2020,218901,69,True,nick170708!,2025-07-01T21:38:43Z,rap,OVO/We The Best/Epic,0.695,0.343,5,-10.798,1,0.0432,0.0743,1.04e-06,0.107,0.229,85.84,4,2020
spotify:track:5Xhqh4lwJPtMUTsdBztN1a,Me Gusta,Me Gusta,Shakira;Anuel AA,1/13/2020,190570,66,False,nick170708!,2025-07-01T21:38:47Z,"latin pop,reggaeton,trap latino,urbano latino,latin",Sony Music Latin,0.775,0.696,1,-5.184,0,0.0681,0.0559,0.00184,0.157,0.775,92.007,4,2020
spotify:track:4QnC1bIaMSfDQvF4XDhV5M,Boyfriend,Rare (Deluxe),Selena Gomez,4/9/2020,161188,50,False,nick170708!,2025-07-01T21:38:49Z,,Interscope Records,0.811,0.512,2,-6.381,1,0.17,0.218,0.0262,0.0767,0.346,92.047,4,2020
spotify:track:463PQggkmk5tTw8ug0ahOX,The Other Side (from Trolls World Tour),The Other Side (from Trolls World Tour),SZA;Justin Timberlake,2/26/2020,188186,59,False,nick170708!,2025-07-01T21:38:52Z,r&b,RCA Records Label,0.76,0.607,7,-6.274,1,0.0964,0.00277,0.0,0.132,0.709,105.979,4,2020
spotify:track:6wQlQrTY5mVS8EGaFZVwVF,Smile (with The Weeknd),Legends Never Die,Juice WRLD;The Weeknd,7/10/2020,196180,68,True,nick170708!,2025-07-01T21:39:03Z,"melodic rap,emo rap",Grade A Productions/Interscope Records,0.694,0.685,6,-6.535,0,0.133,0.224,0.0,0.124,0.306,158.831,4,2020
spotify:track:0TrPqhAMoaKUFLR7iYDokf,Know Your Worth,Know Your Worth,Khalid;Disclosure,2/4/2020,181436,63,False,nick170708!,2025-07-01T21:39:19Z,house,"Right Hand Music Group, LLC/RCA Records",0.79,0.694,9,-7.726,0,0.0708,0.145,0.00252,0.281,0.508,103.007,4,2020
spotify:track:6cy3ki60hLwimwIje7tALf,RITMO (Bad Boys For Life),RITMO (Bad Boys For Life),Black Eyed Peas;J Balvin,10/12/2019,221714,69,True,nick170708!,2025-07-01T21:39:35Z,"reggaeton,latin",Epic/We The Best,0.721,0.716,10,-7.037,0,0.0657,0.0334,0.00084,0.237,0.667,104.994,4,2020
spotify:track:1fipvP2zmef6vN2IwXfJhY,Im Ready (with Demi Lovato),Im Ready (with Demi Lovato),Sam Smith;Demi Lovato,4/16/2020,200838,51,False,nick170708!,2025-07-01T21:40:08Z,soft pop,PLG - Capitol,0.501,0.674,5,-6.363,1,0.0408,0.00346,3.56e-05,0.282,0.152,155.051,4,2020
spotify:track:7lPN2DXiMsVn7XUKtOW1CS,drivers license,drivers license,Olivia Rodrigo,1/8/2021,242013,24,True,nick170708!,2021-05-18T14:44:57Z,,Olivia Rodrigo PS,0.585,0.436,10,-8.761,1,0.0601,0.721,1.31e-05,0.105,0.132,143.874,4,2021
spotify:track:37BZB0z9T8Xu7U3e65qxFy,Save Your Tears (with Ariana Grande) (Remix),Save Your Tears (Remix),The Weeknd;Ariana Grande,4/23/2021,191013,79,False,nick170708!,2021-05-18T14:45:46Z,pop,Republic Records,0.65,0.825,0,-4.645,1,0.0325,0.0215,2.44e-05,0.0936,0.593,118.091,4,2021
spotify:track:463CkQjx2Zk1yXoBuierM9,Levitating (feat. DaBaby),Levitating (feat. DaBaby),Dua Lipa;DaBaby,10/1/2020,203064,67,False,nick170708!,2021-05-18T14:45:31Z,pop,Warner Records,0.702,0.825,6,-3.787,0,0.0601,0.00883,0.0,0.0674,0.915,102.977,4,2021
spotify:track:748mdHapucXQri7IAO8yFK,Kiss Me More (feat. SZA),Kiss Me More (feat. SZA),Doja Cat;SZA,4/9/2021,208866,8,True,nick170708!,2021-05-18T14:46:10Z,r&b,Kemosabe Records/RCA Records,0.762,0.701,8,-3.541,1,0.0286,0.235,0.000158,0.123,0.742,110.968,4,2021
spotify:track:61KpQadow081I2AsbeLcsb,deja vu,deja vu,Olivia Rodrigo,4/1/2021,215507,12,True,nick170708!,2021-05-18T14:46:36Z,,Olivia Rodrigo PS,0.439,0.61,9,-7.236,1,0.116,0.593,1.07e-05,0.341,0.172,181.088,4,2021
spotify:track:4iJyoBOLtHqaGxP12qzhQI,Peaches (feat. Daniel Caesar & Giveon),Justice,Justin Bieber;Daniel Caesar;GIV?ON,3/19/2021,198081,81,True,nick170708!,2021-05-18T14:45:20Z,r&b,RBMG/Def Jam,0.677,0.696,0,-6.181,1,0.119,0.321,0.0,0.42,0.464,90.03,4,2021
spotify:track:0gplL1WMoJ6iYaPgMCL0gX,Easy On Me,Easy On Me,Adele,10/14/2021,224694,78,False,nick170708!,2021-10-14T23:59:01Z,soft pop,Columbia,0.604,0.366,5,-7.519,1,0.0282,0.578,0.0,0.133,0.13,141.981,4,2021
spotify:track:6PERP62TejQjgHu81OHxgM,good 4 u,good 4 u,Olivia Rodrigo,5/14/2021,178147,23,True,nick170708!,2021-05-18T14:57:24Z,,Olivia Rodrigo PS,0.556,0.661,6,-5.052,0,0.204,0.3,0.0,0.101,0.668,168.56,4,2021
spotify:track:7MAibcTli4IisCtbHKrGMh,Leave The Door Open,Leave The Door Open,Bruno Mars;Anderson .Paak;Silk Sonic,3/5/2021,242096,3,False,nick170708!,2021-05-18T14:45:25Z,,Aftermath Entertainment/Atlantic,0.586,0.616,5,-7.964,1,0.0324,0.182,0.0,0.0927,0.719,148.088,4,2021
spotify:track:5HCyWlXZPP0y6Gqq8TgA20,STAY (with Justin Bieber),STAY (with Justin Bieber),The Kid LAROI;Justin Bieber,7/9/2021,141805,81,True,nick170708!,2021-07-15T13:37:41Z,,Columbia,0.591,0.764,1,-5.484,1,0.0483,0.0383,0.0,0.103,0.478,169.928,4,2021
spotify:track:3FAJ6O0NOHQV8Mc5Ri6ENp,Heartbreak Anniversary,TAKE TIME,GIV?ON,3/27/2020,198370,78,False,nick170708!,2021-05-18T14:46:25Z,r&b,Epic/Not So Fast,0.449,0.465,0,-8.964,1,0.0791,0.524,1.02e-06,0.303,0.543,89.087,3,2021
spotify:track:4S4QJfBGGrC8jRIjJHf1Ka,Pain,to hell with it,PinkPantheress,10/15/2021,98544,81,False,nick170708!,2025-07-01T21:33:46Z,bedroom pop,Parlophone UK,0.829,0.617,1,-8.497,1,0.14,0.227,0.00306,0.0618,0.81,125.605,4,2021
spotify:track:0k4d5YPDr1r7FX77VdqWez,You Right,Planet Her,Doja Cat;The Weeknd,6/25/2021,186173,81,True,nick170708!,2021-06-27T17:07:18Z,,Kemosabe Records/RCA Records,0.828,0.621,8,-6.414,1,0.0565,0.0164,0.00233,0.0845,0.436,128.986,4,2021
spotify:track:4RVwu0g32PAqgUiJoXsdF8,Happier Than Ever,Happier Than Ever,Billie Eilish,7/30/2021,298899,84,True,nick170708!,2021-10-04T12:30:50Z,,Darkroom/Interscope Records,0.332,0.225,0,-8.697,1,0.0348,0.767,0.00349,0.128,0.297,81.055,3,2021
spotify:track:3Wrjm47oTz2sjIgck11l5e,Beggin',Chosen,Måneskin,12/8/2017,211560,85,False,nick170708!,2021-07-21T22:37:11Z,,RCA Records Label,0.714,0.8,11,-4.808,0,0.0504,0.127,0.0,0.359,0.589,134.002,4,2021
spotify:track:3YJJjQPAbDT7mGpX3WtQ9A,Good Days,Good Days,SZA,12/25/2020,279203,73,True,nick170708!,2021-05-18T14:46:18Z,r&b,Top Dawg Entertainment/RCA Records,0.436,0.655,1,-8.37,0,0.0583,0.499,8.1e-06,0.688,0.412,121.002,4,2021
spotify:track:67BtfxlNbhBmCDR2L2l8qd,MONTERO (Call Me By Your Name),MONTERO (Call Me By Your Name),Lil Nas X,3/31/2021,137875,70,True,nick170708!,2021-05-18T14:45:13Z,,Columbia,0.61,0.508,8,-6.682,0,0.152,0.297,0.0,0.384,0.758,178.818,4,2021
spotify:track:6Uj1ctrBOjOas8xZXGqKk4,Woman,Planet Her,Doja Cat,6/25/2021,172626,84,True,nick170708!,2021-09-10T01:59:50Z,,Kemosabe Records/RCA Records,0.824,0.764,5,-4.175,0,0.0854,0.0888,0.00294,0.117,0.881,107.998,4,2021
spotify:track:6Im9k8u9iIzKMrmV7BWtlF,34+35,Positions,Ariana Grande,10/30/2020,173710,77,True,nick170708!,2021-05-18T14:45:36Z,pop,Republic Records,0.83,0.585,0,-6.476,1,0.094,0.237,0.0,0.248,0.485,109.978,4,2021
spotify:track:6tDDoYIxWvMLTdKpjFkc1B,telepatía,Sin Miedo (del Amor y Otros Demonios) ?,Kali Uchis,12/4/2020,160191,83,False,nick170708!,2021-05-18T14:46:30Z,,EMI / Interscope,0.653,0.524,11,-9.016,0,0.0502,0.112,0.0,0.203,0.553,83.97,4,2021
spotify:track:0lx2cLdOt3piJbcaXIV74f,willow,evermore,Taylor Swift,12/11/2020,214706,74,False,nick170708!,2021-05-18T14:47:49Z,,Taylor Swift,0.392,0.574,7,-9.195,1,0.17,0.833,0.00179,0.145,0.529,81.112,4,2021
spotify:track:60ynsPSSKe6O3sfwRnIBRf,Streets,Hot Pink,Doja Cat,11/7/2019,226978,84,True,nick170708!,2021-05-18T14:46:49Z,,Kemosabe Records/RCA Records,0.749,0.463,11,-8.433,1,0.0842,0.21,0.0382,0.338,0.189,90.035,4,2021
spotify:track:2rrq3SGYxk90xLx5fMmPhZ,I Must Apologise,to hell with it,PinkPantheress,10/15/2021,108373,74,False,nick170708!,2025-10-20T22:26:23Z,bedroom pop,Parlophone UK,0.616,0.856,9,-6.098,1,0.0457,0.516,0.0652,0.245,0.75,157.109,4,2021
spotify:track:6PQ88X9TkUIAUIZJHW2upE,Bad Habits,Bad Habits,Ed Sheeran,6/25/2021,231041,9,False,nick170708!,2021-06-27T17:07:07Z,soft pop,Atlantic Records UK,0.808,0.897,11,-3.712,0,0.0348,0.0469,3.14e-05,0.364,0.591,126.026,4,2021
spotify:track:3VqeTFIvhxu3DIe4eZVzGq,Butter,Butter,BTS,5/21/2021,164441,1,False,nick170708!,2021-05-21T14:38:14Z,k-pop,BIGHIT MUSIC / HYBE,0.759,0.459,8,-5.187,1,0.0948,0.00323,0.0,0.0906,0.695,109.997,4,2021
spotify:track:3Ofmpyhv5UAQ70mENzB277,Astronaut In The Ocean,Astronaut In The Ocean,Masked Wolf,1/6/2021,132780,71,True,nick170708!,2021-05-18T14:46:00Z,,Elektra (NEK),0.778,0.695,4,-6.865,0,0.0913,0.175,0.0,0.15,0.472,149.996,4,2021
spotify:track:40iJIUlhi6renaREYGeIDS,Fair Trade (with Travis Scott),Certified Lover Boy,Drake;Travis Scott,9/3/2021,291175,81,True,nick170708!,2021-09-10T01:59:42Z,rap,OVO,0.666,0.465,1,-8.545,1,0.26,0.0503,0.0,0.215,0.292,167.937,4,2021
spotify:track:4pt5fDVTg5GhEvEtlz9dKk,I WANNA BE YOUR SLAVE,Teatro d'ira - Vol. I,Måneskin,3/19/2021,173346,83,True,nick170708!,2021-07-21T22:37:20Z,,RCA Records Label,0.75,0.608,1,-4.008,1,0.0387,0.00165,0.0,0.178,0.958,132.507,4,2021
spotify:track:10hcDov7xmcRviA8jLwEaI,Need to Know,Need to Know,Doja Cat,6/11/2021,210560,1,True,nick170708!,2021-06-13T16:05:36Z,,Kemosabe Records/RCA Records,0.664,0.609,1,-6.509,1,0.0707,0.304,0.0,0.0926,0.194,130.041,4,2021
spotify:track:2Xr1dTzJee307rmrkt8c0g,love nwantiti (ah ah ah),CKay The First,CKay,8/30/2019,145800,76,True,nick170708!,2021-10-04T12:30:39Z,"afrobeats,afrobeat,afro r&b,afropop",Chocolate City Music,0.727,0.739,8,-3.805,1,0.0411,0.365,0.00137,0.161,0.533,93.005,4,2021
spotify:track:3UoULw70kMsiVXxW0L3A33,pov,Positions,Ariana Grande,10/30/2020,201882,76,False,nick170708!,2021-05-18T14:51:47Z,pop,Republic Records,0.487,0.534,0,-5.664,0,0.0555,0.36,0.0,0.1,0.173,131.798,4,2021
spotify:track:5enxwA8aAbwZbf5qCHORXi,All Too Well (10 Minute Version) (Taylor's Version) (From The Vault),Red (Taylor's Version),Taylor Swift,11/12/2021,613026,81,True,nick170708!,2021-12-02T00:47:43Z,,Taylor Swift,0.631,0.518,0,-8.771,1,0.0303,0.274,0.0,0.088,0.205,93.023,4,2021
spotify:track:5JCoSi02qi3jJeHdZXMmR8,favorite crime,SOUR,Olivia Rodrigo,5/21/2021,152666,82,False,nick170708!,2024-04-15T23:46:06Z,,Olivia Rodrigo PS,0.369,0.272,9,-10.497,1,0.0364,0.866,0.0,0.147,0.218,172.929,4,2021
spotify:track:3FeVmId7tL5YN8B7R3imoM,My Universe,My Universe,Coldplay;BTS,9/24/2021,228000,74,False,nick170708!,2021-10-04T12:30:24Z,k-pop,Parlophone UK,0.588,0.701,9,-6.39,1,0.0402,0.00813,0.0,0.2,0.443,104.988,4,2021
spotify:track:7hU3IHwjX150XLoTVmjD0q,MONEY,LALISA,LISA,9/10/2021,168227,73,True,nick170708!,2023-04-21T20:30:38Z,k-pop,YG Entertainment/Interscope Records,0.831,0.554,1,-9.998,0,0.218,0.161,6.12e-05,0.152,0.396,140.026,4,2021
spotify:track:5Z9KJZvQzH6PFmb8SNkxuk,INDUSTRY BABY (feat. Jack Harlow),MONTERO,Lil Nas X;Jack Harlow,9/17/2021,212352,75,True,nick170708!,2022-05-16T17:09:07Z,,Columbia,0.741,0.691,10,-7.395,0,0.0672,0.0221,0.0,0.0476,0.892,150.087,4,2021
spotify:track:0RbW8kWozrVSIGb4V13o0o,Hurricane,Donda,Kanye West,8/29/2021,243187,20,False,nick170708!,2021-09-10T02:00:08Z,rap,Rock The World/IDJ/Kanye LP7,0.587,0.561,0,-6.569,1,0.146,0.0466,0.0,0.109,0.351,80.009,4,2021
spotify:track:4u4NyuceXP7Uzh7XFJKCr1,Hold On,Hold On,Justin Bieber,3/5/2021,170813,65,False,nick170708!,2021-05-18T14:48:22Z,,RBMG/Def Jam,0.658,0.634,1,-5.797,0,0.0413,0.0106,0.0,0.132,0.29,139.98,4,2021
spotify:track:4fSIb4hdOQ151TILNsSEaF,Todo De Ti,Todo De Ti,Rauw Alejandro,5/20/2021,199604,73,True,nick170708!,2021-06-08T15:35:59Z,"reggaeton,urbano latino,trap latino,latin",Sony Music Latin/Duars Entertainment,0.78,0.718,3,-3.605,0,0.0506,0.31,0.000163,0.0932,0.342,127.949,4,2021
spotify:track:2sXf2JdbB2GlNju00kw9WE,Skate,Skate,Bruno Mars;Anderson .Paak;Silk Sonic,7/30/2021,203122,1,False,nick170708!,2021-09-20T03:13:58Z,,Aftermath Entertainment/Atlantic,0.708,0.598,5,-8.365,1,0.0291,0.037,0.0,0.17,0.698,112.027,4,2021
spotify:track:1mSdbey7RstGLY2udgXv74,Essence (feat. Justin Bieber & Tems),Essence (feat. Justin Bieber & Tems),Wizkid;Justin Bieber;Tems,8/13/2021,263288,58,False,nick170708!,2024-05-11T14:16:11Z,"afrobeats,afrobeat,afropop,azonto,afroswing,afro r&b,afropiano,alté",Starboy/RCA Records,0.835,0.691,0,-5.828,1,0.113,0.0159,1.44e-05,0.108,0.581,103.999,4,2021
spotify:track:5qNh5WtzMbfpSj2jLlBkoD,Your Power,Your Power,Billie Eilish,4/29/2021,245896,1,False,nick170708!,2021-06-08T15:35:11Z,,Darkroom/Interscope Records,0.634,0.285,9,-14.007,0,0.0807,0.937,0.000359,0.232,0.203,129.65,4,2021
spotify:track:3USxtqRwSYz57Ewm6wWRMp,Heat Waves,Dreamland,Glass Animals,8/7/2020,238805,86,False,nick170708!,2021-09-20T03:13:36Z,,Polydor Records,0.761,0.525,11,-6.9,1,0.0944,0.44,6.7e-06,0.0921,0.531,80.87,4,2021
spotify:track:6f3Slt0GbA2bPZlz0aIFXN,The Business,The Business,Tiësto,9/16/2020,164000,74,False,nick170708!,2021-05-18T14:49:47Z,"edm,trance,big room",Atlantic Records,0.798,0.62,8,-7.079,0,0.232,0.414,0.0192,0.112,0.235,120.031,4,2021
spotify:track:1XXimziG1uhM0eDNCZCrUl,Up,Up,Cardi B,2/5/2021,156944,66,True,nick170708!,2021-05-18T14:46:05Z,,Atlantic Records,0.868,0.795,11,-6.044,1,0.269,0.0012,0.0193,0.0461,0.819,166.0,4,2021
spotify:track:079Ey5uxL04AKPQgVQwx5h,Baila Conmigo (with Rauw Alejandro),Revelación - EP,Selena Gomez;Rauw Alejandro,3/12/2021,186087,65,False,nick170708!,2021-05-18T14:47:20Z,"reggaeton,urbano latino,trap latino,latin",Selena Gomez Latin Project,0.823,0.544,5,-7.132,1,0.0715,0.0215,0.00315,0.0966,0.664,149.903,4,2021
spotify:track:2JPLbjOn0wPCngEot2STUS,Yonaguni,Yonaguni,Bad Bunny,6/4/2021,206710,79,True,nick170708!,2021-06-08T15:35:17Z,"reggaeton,trap latino,urbano latino,latin",Rimas Entertainment LLC,0.644,0.648,1,-4.601,1,0.118,0.276,0.0,0.135,0.44,179.951,4,2021
spotify:track:0A1hoCfMLkiAgvhWkkucJa,Body,Good News,Megan Thee Stallion,11/20/2020,171067,67,True,nick170708!,2021-05-18T14:50:45Z,,300 Entertainment,0.914,0.732,8,-6.1,0,0.241,0.0166,0.0,0.107,0.469,94.066,4,2021
spotify:track:35mvY5S1H3J2QZyna3TFe0,positions,Positions,Ariana Grande,10/30/2020,172324,80,True,nick170708!,2021-05-18T14:47:34Z,pop,Republic Records,0.737,0.802,0,-4.771,1,0.0878,0.468,0.0,0.0931,0.682,144.015,4,2021
spotify:track:5CZ40GBx1sQ9agT82CLQCT,traitor,SOUR,Olivia Rodrigo,5/21/2021,229226,87,False,nick170708!,2022-08-28T19:58:38Z,,Olivia Rodrigo PS,0.38,0.339,3,-7.885,1,0.0338,0.691,0.0,0.12,0.0849,100.607,4,2021
spotify:track:4Ld4kbKo1eOzToQ0P8JA0V,Arcade (feat. FLETCHER),Small Town Boy,Duncan Laurence;FLETCHER,11/27/2020,187453,68,False,nick170708!,2021-12-03T17:58:17Z,,"Universal Music, a division of Universal International Music BV",0.446,0.395,0,-9.328,1,0.0365,0.815,0.00216,0.128,0.267,71.944,3,2021
spotify:track:7BoobGhD4x5K96Me0hqC8Q,Build a Bitch,Build a Bitch,Bella Poarch,5/14/2021,122772,68,True,nick170708!,2021-06-08T15:35:41Z,,Warner Records,0.855,0.463,3,-7.454,1,0.0367,0.217,1.77e-05,0.347,0.866,102.931,4,2021
spotify:track:5vGLcdRuSbUhD8ScwsGSdA,Whoopty,Whoopty,CJ,8/20/2020,123262,63,True,nick170708!,2021-05-18T14:48:36Z,dembow,CJ Music Group/T-Series,0.719,0.648,3,-7.6,0,0.125,0.2,0.0,0.127,0.66,140.201,4,2021
spotify:track:4MzXwWMhyBbmu6hOcLVD49,DÁKITI,EL ÚLTIMO TOUR DEL MUNDO,Bad Bunny;JHAYCO,11/27/2020,205090,77,True,nick170708!,2021-05-18T14:47:30Z,"reggaeton,trap latino,urbano latino,latin",Rimas Entertainment LLC,0.731,0.573,4,-10.059,0,0.0544,0.401,5.22e-05,0.113,0.145,109.928,4,2021
spotify:track:6fRxMU4LWwyaSSowV441IU,Beautiful Mistakes (feat. Megan Thee Stallion),Beautiful Mistakes (feat. Megan Thee Stallion),Maroon 5;Megan Thee Stallion,3/3/2021,227395,29,False,nick170708!,2021-05-18T14:49:23Z,pop,222 Records/Interscope Records,0.713,0.676,10,-5.483,1,0.027,0.0377,0.0,0.154,0.721,99.048,4,2021
spotify:track:75MNhvTCCKsST3YqqUiU9r,Shivers,Shivers,Ed Sheeran,9/13/2021,207853,11,False,nick170708!,2021-10-04T12:30:31Z,soft pop,Atlantic Records UK,0.788,0.859,2,-2.724,1,0.0856,0.281,0.0,0.0424,0.822,141.02,4,2021
spotify:track:3KdoeNlEN0BoAKWzaRLNZa,Solar Power,Solar Power,Lorde,6/10/2021,192621,0,False,nick170708!,2021-06-13T16:05:30Z,,Universal Music New Zealand Limited,0.735,0.47,4,-9.405,1,0.1,0.266,0.000105,0.32,0.897,87.971,4,2021
spotify:track:1diS6nkxMQc3wwC4G1j0bh,We're Good,Future Nostalgia (The Moonlight Edition),Dua Lipa,2/11/2021,165506,68,False,nick170708!,2021-05-18T14:46:43Z,pop,Warner Records,0.722,0.588,6,-5.932,1,0.0544,0.0319,0.0,0.183,0.59,134.01,4,2021
spotify:track:1EHUQesfVKwbthtNcpBi9g,WITHOUT YOU (with Miley Cyrus),WITHOUT YOU (with Miley Cyrus),The Kid LAROI;Miley Cyrus,4/30/2021,161384,61,True,nick170708!,2021-05-18T14:47:02Z,,Columbia,0.655,0.469,0,-6.257,1,0.0292,0.173,0.0,0.0956,0.467,92.56,4,2021
spotify:track:3CeCwYWvdfXbZLXFhBrbnf,Love Story (Taylors Version),Love Story (Taylors Version),Taylor Swift,2/12/2021,235766,77,False,nick170708!,2021-05-18T14:48:31Z,,Taylor Swift,0.626,0.79,2,-4.302,1,0.0311,0.135,3.97e-06,0.0989,0.416,119.082,4,2021
spotify:track:1fxYz1s15pyZLsJT0Hdh1m,late at night,late at night,Roddy Ricch,6/4/2021,174682,58,True,nick170708!,2022-08-27T14:17:30Z,melodic rap,Atlantic Records,0.643,0.403,1,-11.254,0,0.41,0.343,0.0,0.138,0.111,98.54,4,2021
spotify:track:3J8EOeKLTLXORtWPpOU5bE,Calling My Phone,Destined 2 Win,Lil Tjay;6LACK,4/2/2021,205458,76,True,nick170708!,2021-05-18T14:47:15Z,"brooklyn drill,melodic rap",Columbia,0.907,0.393,4,-7.636,0,0.0539,0.451,1.35e-06,0.135,0.202,104.949,4,2021
spotify:track:18vXApRmJSgQ6wG2ll9AOg,RAPSTAR,Hall of Fame,Polo G,6/11/2021,165925,76,True,nick170708!,2022-07-28T21:26:48Z,,Columbia,0.789,0.536,6,-6.862,1,0.242,0.41,0.0,0.129,0.437,81.039,4,2021
spotify:track:37Nqx7iavZpotJSDXZWbJ3,Girls Want Girls (with Lil Baby),Certified Lover Boy,Drake;Lil Baby,9/3/2021,221979,77,True,nick170708!,2021-09-20T03:13:11Z,rap,OVO,0.767,0.438,7,-8.726,0,0.29,0.181,0.0,0.142,0.381,86.975,4,2021
spotify:track:4jPy3l0RUwlUI9T5XHBW2m,Mood (feat. iann dior),El Dorado,24kGoldn;iann dior,3/26/2021,140525,78,True,nick170708!,2021-05-18T14:48:07Z,melodic rap,Records/Columbia,0.701,0.716,7,-3.671,0,0.0361,0.174,0.0,0.324,0.732,91.007,4,2021
spotify:track:3ggtU1ZOKO8ZNiqPNyXGcm,Dinero,Dinero,Trinidad Cardona,2/2/2018,160880,67,True,nick170708!,2024-09-17T19:29:11Z,,Run It Up Records/Island,0.709,0.782,2,-4.687,1,0.0672,0.00774,0.0,0.107,0.484,119.997,4,2021
spotify:track:2XIc1pqjXV3Cr2BQUGNBck,LA NOCHE DE ANOCHE,EL ÚLTIMO TOUR DEL MUNDO,Bad Bunny;ROSALÍA,11/27/2020,203200,78,False,nick170708!,2021-05-18T14:49:16Z,"reggaeton,trap latino,urbano latino,latin",Rimas Entertainment LLC,0.856,0.618,7,-4.892,1,0.286,0.0303,0.0,0.0866,0.391,81.993,4,2021
spotify:track:31qCy5ZaophVA81wtlwLc4,Anyone,Anyone,Justin Bieber,1/1/2021,190779,66,False,nick170708!,2021-05-18T14:46:58Z,,RBMG/Def Jam,0.686,0.538,2,-8.026,1,0.0345,0.181,3.13e-06,0.113,0.584,115.884,4,2021
spotify:track:07MDkzWARZaLEdKxo6yArG,Meet Me At Our Spot,THE ANXIETY,THE ANXIETY;WILLOW;Tyler Cole,3/13/2020,162680,74,True,nick170708!,2022-05-15T19:44:18Z,,"MSFTSMusic / Roc Nation Records, LLC",0.773,0.47,2,-7.93,1,0.0299,0.0153,0.000193,0.0851,0.399,94.995,4,2021
spotify:track:0E4Y1XIbs8GrAT1YqVy6dq,Afterglow,Afterglow,Ed Sheeran,12/21/2020,185486,67,False,nick170708!,2021-05-18T14:47:40Z,soft pop,Atlantic Records UK,0.641,0.324,11,-5.851,1,0.0299,0.698,0.0,0.328,0.273,110.184,4,2021
spotify:track:1zLBsSVxETQOfINOLYvT5m,GIRL LIKE ME,TRANSLATION,Black Eyed Peas;Shakira,11/2/2020,222522,79,True,nick170708!,2021-05-18T14:48:58Z,latin pop,Epic,0.965,0.485,2,-8.784,1,0.191,0.0206,0.0237,0.0655,0.312,124.025,4,2021
spotify:track:7vrJn5hDSXRmdXoR30KgF1,BICHOTA,BICHOTA,KAROL G,10/23/2020,178946,65,True,nick170708!,2021-05-18T14:48:17Z,"reggaeton,latin,urbano latino",UMLE - Latino,0.863,0.666,1,-4.158,0,0.152,0.212,0.000493,0.103,0.838,163.908,4,2021
spotify:track:1xK1Gg9SxG8fy2Ya373oqb,Bandido,Bandido,Myke Towers;Juhn,12/10/2020,232853,69,False,nick170708!,2021-05-18T14:48:46Z,"reggaeton,trap latino,urbano latino",White World Music,0.713,0.617,8,-4.637,1,0.0887,0.122,0.0,0.0962,0.682,168.021,4,2021
spotify:track:5JqZ3oqF00jkT81foAFvqg,Prisoner (feat. Dua Lipa),Prisoner (feat. Dua Lipa),Miley Cyrus;Dua Lipa,11/20/2020,169333,1,False,nick170708!,2021-05-18T14:49:06Z,pop,RCA Records Label,0.781,0.67,3,-3.912,0,0.0452,0.0103,0.0,0.0761,0.595,127.99,4,2021
spotify:track:0VjIjW4GlUZAMYd2vXMi3b,Blinding Lights,After Hours,The Weeknd,3/20/2020,200040,90,False,nick170708!,2021-05-18T14:49:10Z,,Republic Records,0.513,0.73,1,-5.94,1,0.0598,0.00143,9.54e-05,0.0897,0.334,171.001,4,2021
spotify:track:78ul3D77noQsYjSwvwiPU1,Break It Off - Bonus,to hell with it,PinkPantheress,10/15/2021,96133,72,False,nick170708!,2025-10-20T22:26:27Z,bedroom pop,Parlophone UK,0.552,0.904,11,-4.891,0,0.114,0.0027,8.85e-06,0.0786,0.746,171.788,4,2021
spotify:track:3eZYOQO4UzKrUDYDghtnFw,test drive,Positions (Deluxe),Ariana Grande,2/19/2021,122174,62,False,nick170708!,2021-05-18T14:49:35Z,pop,Republic Records,0.698,0.708,9,-4.943,0,0.0454,0.0251,0.0,0.124,0.322,115.036,4,2021
spotify:track:02kDW379Yfd5PzW5A6vuGt,Lemonade,"Lemonade (feat. Gunna, Don Toliver & NAV)",Internet Money;Gunna;Don Toliver;NAV,8/14/2020,195428,3,True,nick170708!,2021-05-18T14:50:01Z,melodic rap,Internet Money Records/ TenThousand Projects,0.799,0.66,1,-6.153,0,0.079,0.256,0.0,0.111,0.471,140.04,4,2021
spotify:track:6UelLqGlWMcVH1E5c4H7lY,Watermelon Sugar,Fine Line,Harry Styles,12/13/2019,173991,83,False,nick170708!,2021-05-18T14:49:54Z,,Columbia,0.548,0.816,0,-4.209,1,0.0465,0.122,0.0,0.335,0.557,95.39,4,2021
spotify:track:2xdwCJLfKCkat14mlgR26M,Lost Cause,Lost Cause,Billie Eilish,6/2/2021,212496,0,True,nick170708!,2021-06-08T15:35:29Z,,Darkroom/Interscope Records,0.671,0.336,10,-8.494,0,0.241,0.705,0.00751,0.0577,0.518,75.051,4,2021
spotify:track:3XoflnowYPFRPOh3uFvHcm,Selfish Love (with Selena Gomez),Selfish Love (with Selena Gomez),DJ Snake;Selena Gomez,3/4/2021,168648,54,False,nick170708!,2021-05-18T14:50:06Z,,DJ Snake Music Productions Limited,0.723,0.646,5,-7.973,0,0.102,0.0206,0.352,0.0994,0.443,110.971,4,2021
spotify:track:5TnQ453LtEy08EwrIUtB1e,What You Know Bout Love,LOVE,Pop Smoke,5/14/2021,160000,0,True,nick170708!,2021-05-18T14:50:20Z,"brooklyn drill,new york drill,drill",UME - Global Clearing House,0.584,0.547,7,-8.502,0,0.382,0.655,1.64e-06,0.134,0.56,83.917,4,2021
spotify:track:4saklk6nie3yiGePpBwUoc,Dynamite,BE,BTS,11/20/2020,199053,3,False,nick170708!,2021-05-18T14:50:27Z,k-pop,BIGHIT MUSIC / HYBE,0.746,0.765,6,-4.41,0,0.0993,0.0112,0.0,0.0936,0.737,114.044,4,2021
spotify:track:6cx06DFPPHchuUAcTxznu9,Head & Heart (feat. MNEK),Head & Heart (feat. MNEK),Joel Corry;MNEK,7/3/2020,166028,75,False,nick170708!,2021-05-18T14:50:33Z,dance pop,Atlantic Records UK,0.734,0.874,8,-3.158,1,0.0662,0.168,1.14e-05,0.0489,0.905,122.953,4,2021
spotify:track:2etHQJxIbV0soyPhelVs9Y,Best Friend (feat. Doja Cat),Best Friend (feat. Doja Cat),Saweetie;Doja Cat,1/7/2021,155883,66,True,nick170708!,2021-05-18T14:50:51Z,,ICY/Warner Records,0.84,0.766,4,-4.12,1,0.136,0.00302,3.61e-06,0.0684,0.402,94.018,4,2021
spotify:track:3aQem4jVGdhtg116TmJnHz,Whats Next,Scary Hours 2,Drake,3/5/2021,178153,67,True,nick170708!,2021-05-18T14:51:05Z,rap,OVO,0.781,0.594,0,-6.959,0,0.0485,0.0136,0.0,0.162,0.0628,129.895,4,2021
spotify:track:2pn8dNVSpYnAtlKFC8Q0DJ,On The Ground,R,ROSÉ,3/12/2021,168085,67,False,nick170708!,2021-05-18T14:51:11Z,k-pop,YG Entertainment/Interscope Records,0.311,0.607,1,-6.578,1,0.11,0.0174,0.0,0.131,0.286,188.7,4,2021
spotify:track:6F2r4HgpJnvKDmkN6JEN6J,As I Am (feat. Khalid),Justice,Justin Bieber;Khalid,3/19/2021,174406,61,False,nick170708!,2021-05-18T14:51:35Z,,RBMG/Def Jam,0.595,0.543,11,-8.149,1,0.038,0.127,0.0,0.0975,0.109,99.928,4,2021
spotify:track:0LThjFY2iTtNdd4wviwVV2,Permission to Dance,Butter / Permission to Dance,BTS,7/9/2021,187585,1,False,nick170708!,2021-07-15T13:37:48Z,k-pop,BIGHIT MUSIC,0.702,0.741,9,-5.33,1,0.0427,0.00544,0.0,0.337,0.646,124.925,4,2021
spotify:track:0BI0hfbmqybnd3TezrDME3,Met Him Last Night (feat. Ariana Grande),Dancing With The DevilThe Art of Starting Over,Demi Lovato;Ariana Grande,4/2/2021,204631,52,True,nick170708!,2021-05-18T14:51:43Z,pop,Island Records,0.538,0.512,4,-4.548,0,0.0262,0.22,0.0,0.101,0.12,144.978,4,2021
spotify:track:1D3z6HTiQsNmZxjl7F7eoG,m y . l i f e (with 21 Savage & Morray),The Off-Season,J. Cole;21 Savage;Morray,5/14/2021,218801,72,True,nick170708!,2021-05-21T14:38:34Z,rap,"Dreamville, Inc., Under exclusive license to Roc Nation Records",0.597,0.587,7,-7.026,0,0.137,0.0622,0.0,0.214,0.0753,140.021,4,2021
spotify:track:1QL7nSDZCwZMnbisV4KOXt,t r a n s p a r e n t s o u l feat. Travis Barker,t r a n s p a r e n t s o u l feat. Travis Barker,WILLOW;Travis Barker,4/27/2021,168030,62,True,nick170708!,2021-09-20T03:14:28Z,rap rock,"MSFTSMusic / Roc Nation Records, LLC",0.39,0.83,11,-5.201,0,0.0563,0.0021,0.0,0.156,0.191,90.021,4,2021
spotify:track:40uMIn2zJLAQhNXghRjBed,Motley Crew,Motley Crew,Post Malone,7/9/2021,184213,67,True,nick170708!,2021-07-15T13:37:55Z,,Republic Records,0.797,0.631,3,-3.818,0,0.0786,0.0904,3.71e-06,0.0998,0.288,129.915,4,2021
spotify:track:5fwSHlTEWpluwOM0Sxnh5k,Pepas,Pepas,Farruko,6/24/2021,287120,78,True,nick170708!,2021-09-10T02:00:13Z,"reggaeton,trap latino",Sony Music Latin,0.762,0.766,7,-3.955,1,0.0343,0.00776,6.98e-05,0.128,0.442,130.001,4,2021
spotify:track:0e8nrvls4Qqv5Rfa2UhqmO,THATS WHAT I WANT,MONTERO,Lil Nas X,9/17/2021,143901,74,True,nick170708!,2021-09-20T03:13:06Z,,Columbia,0.737,0.846,1,-4.51,0,0.22,0.00614,0.0,0.0486,0.546,87.981,4,2021
spotify:track:6KgtcmCF9Ky68XC7ezxl3s,Rumors (feat. Cardi B),Rumors (feat. Cardi B),Lizzo;Cardi B,8/13/2021,172832,59,True,nick170708!,2021-09-20T03:13:52Z,,Nice Life/Atlantic,0.827,0.731,4,-5.524,0,0.088,0.13,0.0,0.418,0.607,118.992,4,2021
spotify:track:4qu63nuBpdn0qHUHuObEj1,Leave Before You Love Me (with Jonas Brothers),Leave Before You Love Me,Marshmello;Jonas Brothers,5/21/2021,154983,81,False,nick170708!,2021-12-03T17:57:52Z,edm,Republic Records,0.721,0.738,7,-4.77,1,0.0403,0.00226,4.41e-06,0.118,0.637,119.976,4,2021
spotify:track:2plRom0urixt6BE8t7kOhQ,Girl From Rio,Girl From Rio,Anitta,4/29/2021,194421,51,False,nick170708!,2021-12-03T17:58:03Z,"brazilian pop,funk pop,brazilian funk,funk carioca",Warner Records,0.692,0.639,0,-6.717,1,0.0352,0.00727,0.0,0.199,0.733,140.059,4,2021
spotify:track:0z8hI3OPS8ADPWtoCjjLl6,Summer of Love (Shawn Mendes & Tainy),Summer Of Love,Shawn Mendes;Tainy,8/20/2021,184104,67,False,nick170708!,2022-05-15T19:41:54Z,reggaeton,Shawn Mendes LP4-5 PS/ Island,0.776,0.808,11,-4.501,1,0.117,0.0297,0.000127,0.103,0.494,123.988,4,2021
spotify:track:0eu4C55hL6x29mmeAjytzC,Life Goes On,"Ugly is Beautiful: Shorter, Thicker & Uglier (Deluxe)",Oliver Tree,5/28/2021,161803,73,False,nick170708!,2022-05-15T19:44:24Z,,Atlantic Records,0.7,0.49,0,-5.187,1,0.076,0.186,0.0,0.117,0.569,79.982,4,2021
spotify:track:3nY8AqaMNNHHLYV4380ol0,Dick (feat. Doja Cat),Dick (feat. Doja Cat),StarBoi3;Doja Cat,4/23/2021,175238,64,True,nick170708!,2022-05-15T19:44:34Z,,Not specified,0.647,0.608,9,-6.831,1,0.42,0.13,0.0,0.0584,0.474,125.994,4,2021
spotify:track:0WSEq9Ko4kFPt8yo3ICd6T,Praise God,Donda,Kanye West,8/29/2021,226652,72,False,nick170708!,2022-05-15T19:44:50Z,rap,Rock The World/IDJ/Kanye LP7,0.798,0.545,1,-6.466,1,0.168,0.00904,9.48e-05,0.258,0.212,118.029,4,2021
spotify:track:4LRPiXqCikLlN15c3yImP7,As It Was,As It Was,Harry Styles,3/31/2022,167303,21,False,nick170708!,2022-03-31T23:20:52Z,,Columbia,0.52,0.731,6,-5.338,0,0.0557,0.342,0.00101,0.311,0.662,173.93,4,2022
spotify:track:0V3wPSX9ygBnCm8psDIegu,Anti-Hero,Midnights,Taylor Swift,10/21/2022,200690,80,False,nick170708!,2022-10-22T16:50:41Z,,Taylor Swift,0.633,0.648,4,-6.645,1,0.062,0.121,2.62e-06,0.161,0.49,96.888,4,2022
spotify:track:02MWAaffLxlfxAUY7c5dvx,Heat Waves,Dreamland (+ Bonus Levels),Glass Animals,8/6/2020,238805,17,False,nick170708!,2022-01-16T05:45:02Z,,Polydor Records,0.761,0.525,11,-6.9,1,0.0944,0.44,6.7e-06,0.0921,0.531,80.87,4,2022
spotify:track:4k6Uh1HXdhtusDW5y8Gbvy,Bad Habit,Gemini Rights,Steve Lacy,7/15/2022,232114,83,True,nick170708!,2022-07-23T17:36:31Z,,L-M Records/RCA Records,0.686,0.494,1,-7.093,1,0.0355,0.613,5.8e-05,0.402,0.7,168.946,4,2022
spotify:track:27NovPIUIRrOZoCHxABJwK,INDUSTRY BABY (feat. Jack Harlow),INDUSTRY BABY (feat. Jack Harlow),Lil Nas X;Jack Harlow,7/23/2021,212000,74,True,nick170708!,2023-01-10T13:45:01Z,,Columbia,0.736,0.704,3,-7.409,0,0.0615,0.0203,0.0,0.0501,0.894,149.995,4,2022
spotify:track:3nqQXoyQOWXiESFLlDF1hG,Unholy (feat. Kim Petras),Unholy (feat. Kim Petras),Sam Smith;Kim Petras,9/22/2022,156943,77,False,nick170708!,2022-09-23T21:23:27Z,soft pop,Capitol Records UK / EMI,0.719,0.454,2,-7.384,1,0.0707,0.0138,4.83e-06,0.318,0.224,131.007,4,2022
spotify:track:1IHWl5LamUGEuP4ozKQSXZ,Tití Me Preguntó,Un Verano Sin Ti,Bad Bunny,5/6/2022,243716,84,True,nick170708!,2022-11-28T15:03:29Z,"reggaeton,trap latino,urbano latino,latin",Rimas Entertainment LLC,0.65,0.715,5,-5.198,0,0.253,0.0993,0.000291,0.126,0.187,106.672,4,2022
spotify:track:29d0nY7TzCoi22XBqDQkiP,Running Up That Hill (A Deal With God) - 2018 Remaster,Hounds of Love (2018 Remaster),Kate Bush,9/16/1985,300840,4,False,nick170708!,2022-06-24T17:17:24Z,"art pop,baroque pop,art rock",Rhino,0.625,0.533,10,-11.903,0,0.0596,0.659,0.00266,0.0546,0.139,108.296,4,2022
spotify:track:1xzi1Jcr7mEi9K2RfzLOqS,CUFF IT,RENAISSANCE,Beyoncé,7/29/2022,225388,74,True,nick170708!,2022-09-24T04:03:17Z,,Parkwood Entertainment/Columbia,0.78,0.689,7,-5.668,1,0.141,0.0368,9.69e-06,0.0698,0.642,115.042,4,2022
spotify:track:0VO8gYVDSwM1Qdd2GsMoYK,Moth To A Flame (with The Weeknd),Paradise Again,Swedish House Mafia;The Weeknd,4/15/2022,234000,83,False,nick170708!,2025-01-10T21:51:05Z,edm,Republic Records,0.553,0.659,8,-7.295,1,0.0391,0.0027,0.0,0.105,0.105,120.146,4,2022
spotify:track:2ksyzVfU0WJoBpu8otr4pz,METAMORPHOSIS,METAMORPHOSIS,INTERWORLD,11/25/2021,142839,77,True,nick170708!,2025-11-08T13:57:11Z,"phonk,drift phonk,brazilian phonk",INTERWORLD,0.593,0.641,7,-12.727,0,0.0992,0.426,0.901,0.122,0.147,175.014,4,2022
spotify:track:1rDQ4oMwGJI7B4tovsBOxc,First Class,First Class,Jack Harlow,4/8/2022,173947,14,True,nick170708!,2022-04-08T22:08:21Z,,Generation Now/Atlantic,0.905,0.563,8,-6.135,1,0.102,0.0254,9.71e-06,0.113,0.324,106.998,4,2022
spotify:track:1qEmFfgcLObUfQm0j1W2CK,Late Night Talking,Harry's House,Harry Styles,5/20/2022,177954,76,False,nick170708!,2022-05-20T03:30:43Z,,Columbia,0.714,0.728,10,-4.595,1,0.0468,0.298,0.0,0.106,0.901,114.996,4,2022
spotify:track:5CZ40GBx1sQ9agT82CLQCT,traitor,SOUR,Olivia Rodrigo,5/21/2021,229226,87,False,nick170708!,2023-06-29T12:39:02Z,,Olivia Rodrigo PS,0.38,0.339,3,-7.885,1,0.0338,0.691,0.0,0.12,0.0849,100.607,4,2022
spotify:track:6I3mqTwhRpn34SLVafSH7G,Ghost,Justice,Justin Bieber,3/19/2021,153190,84,False,nick170708!,2022-01-16T05:48:27Z,,RBMG/Def Jam,0.601,0.741,2,-5.569,1,0.0478,0.185,2.91e-05,0.415,0.441,153.96,4,2022
spotify:track:6xGruZOHLs39ZbVccQTuPZ,Glimpse of Us,Glimpse of Us,Joji,6/10/2022,233456,8,False,nick170708!,2022-06-19T18:50:15Z,,88rising Music/Warner Records,0.44,0.317,8,-9.258,1,0.0531,0.891,4.78e-06,0.141,0.268,169.914,3,2022
spotify:track:3WMj8moIAXJhHsyLaqIIHI,Something in the Orange,Something in the Orange,Zach Bryan,4/22/2022,228013,86,False,nick170708!,2024-08-31T05:39:13Z,"country,red dirt",Warner Records,0.369,0.192,4,-12.151,0,0.04,0.555,8.35e-06,0.0954,0.148,175.212,3,2022
spotify:track:0mL82sxCRjrs3br407IdJh,Is There Someone Else?,Dawn FM,The Weeknd,1/6/2022,199111,81,False,nick170708!,2024-02-02T17:30:27Z,,XO / Republic Records,0.702,0.586,9,-7.83,0,0.0313,0.0388,7.27e-05,0.156,0.608,134.951,4,2022
spotify:track:2tTmW7RDtMQtBk7m2rYeSw,"Quevedo: Bzrp Music Sessions, Vol. 52/66","Quevedo: Bzrp Music Sessions, Vol. 52/66",Bizarrap;Quevedo,7/6/2022,198937,81,False,nick170708!,2022-07-22T04:23:49Z,"argentine trap,trap latino,urbano latino",DALE PLAY Records,0.621,0.782,2,-5.548,1,0.044,0.0125,0.033,0.23,0.55,128.033,4,2022
spotify:track:6Sq7ltF9Qa7SNFBsV5Cogx,Me Porto Bonito,Un Verano Sin Ti,Bad Bunny;Chencho Corleone,5/6/2022,178567,82,True,nick170708!,2022-06-19T18:50:09Z,"reggaeton,trap latino,urbano latino,latin",Rimas Entertainment LLC,0.911,0.712,1,-5.105,0,0.0817,0.0901,2.68e-05,0.0933,0.425,92.005,4,2022
spotify:track:2FeBslNBMdR9V58uv6hd2t,N95,Mr. Morale & The Big Steppers,Kendrick Lamar,5/13/2022,195950,22,True,nick170708!,2022-05-15T16:16:02Z,"hip hop,west coast hip hop",pgLang/Top Dawg Entertainment/Aftermath/Interscope Records,0.79,0.67,1,-5.527,1,0.105,0.377,2.32e-06,0.119,0.408,139.956,4,2022
spotify:track:3F5CgOj3wFlRv51JsHbxhe,Jimmy Cooks (feat. 21 Savage),"Honestly, Nevermind",Drake;21 Savage,6/17/2022,218364,81,True,nick170708!,2022-07-04T13:53:21Z,rap,OVO,0.529,0.673,0,-4.711,1,0.175,0.000307,2.41e-06,0.093,0.366,165.921,4,2022
spotify:track:1PckUlxKqWQs3RlWXVBLw3,About Damn Time,About Damn Time,Lizzo,4/14/2022,191822,15,True,nick170708!,2022-05-05T02:49:52Z,,Nice Life/Atlantic,0.836,0.743,10,-6.305,0,0.0656,0.0995,0.0,0.335,0.722,108.966,4,2022
spotify:track:5jQI2r1RdgtuT8S3iG8zFC,Lavender Haze,Midnights,Taylor Swift,10/21/2022,202395,72,True,nick170708!,2022-11-28T15:06:30Z,,Taylor Swift,0.735,0.449,7,-10.56,0,0.0883,0.23,0.00126,0.132,0.0955,97.05,4,2022
spotify:track:3IAfUEeaXRX9s9UdKOJrFI,Envolver,Envolver,Anitta,11/11/2021,193805,68,False,nick170708!,2022-03-26T02:01:18Z,"brazilian pop,funk pop,brazilian funk,funk carioca",WEA Latina,0.812,0.736,4,-5.421,0,0.0833,0.152,0.00254,0.0914,0.396,91.993,4,2022
spotify:track:5ildQOEKmJuWGl2vRkFdYc,DESPECHÁ,DESPECHÁ,ROSALÍA,7/28/2022,157017,72,True,nick170708!,2022-07-29T18:18:01Z,latin,Columbia,0.919,0.623,7,-6.521,1,0.0992,0.184,1.63e-05,0.0609,0.775,130.037,4,2022
spotify:track:3Kkjo3cT83cw09VJyrLNwX,Oh My God,30,Adele,11/19/2021,225148,73,False,nick170708!,2022-01-16T05:48:24Z,soft pop,Columbia,0.534,0.725,1,-3.906,1,0.046,0.091,0.0,0.0264,0.55,88.098,4,2022
spotify:track:4fouWK6XVHhzl78KzQ1UjL,abcdefu,abcdefu,GAYLE,8/13/2021,168601,73,True,nick170708!,2022-01-16T05:44:35Z,,Atlantic/Arthouse Records,0.695,0.54,4,-5.692,1,0.0493,0.299,0.0,0.367,0.415,121.932,4,2022
spotify:track:7rglLriMNBPAyuJOMGwi39,Cold Heart - PNAU Remix,The Lockdown Sessions,Elton John;Dua Lipa;PNAU,10/22/2021,202735,69,False,nick170708!,2022-01-16T05:45:06Z,pop,EMI,0.795,0.8,1,-6.32,1,0.0309,0.0354,7.25e-05,0.0915,0.934,116.032,4,2022
spotify:track:50nfwKoDiSYg8zOCREWAm5,Shivers,=,Ed Sheeran,10/25/2021,207853,82,False,nick170708!,2022-01-16T05:45:11Z,soft pop,Atlantic Records UK,0.788,0.859,2,-2.724,1,0.0856,0.281,0.0,0.0424,0.822,141.02,4,2022
spotify:track:0mBP9X2gPCuapvpZ7TGDk3,Left and Right (Feat. Jung Kook of BTS),Left and Right (Feat. Jung Kook of BTS),Charlie Puth;Jung Kook;BTS,6/24/2022,154486,68,False,nick170708!,2022-06-25T14:41:13Z,"soft pop,pop,k-pop",Atlantic Records,0.881,0.592,2,-4.898,1,0.0324,0.619,1.32e-05,0.0901,0.719,101.058,4,2022
spotify:track:1SOClUWhOi8vHZYMz3GluK,Infinity,Feel Something,Jaymes Young,6/23/2017,237720,79,False,nick170708!,2022-01-16T05:45:59Z,,Atlantic Records,0.671,0.673,11,-6.941,0,0.0444,0.148,5.29e-05,0.304,0.494,121.963,4,2022
spotify:track:0e8nrvls4Qqv5Rfa2UhqmO,THATS WHAT I WANT,MONTERO,Lil Nas X,9/17/2021,143901,74,True,nick170708!,2022-01-19T00:40:12Z,,Columbia,0.737,0.846,1,-4.51,0,0.22,0.00614,0.0,0.0486,0.546,87.981,4,2022
spotify:track:3RfTeIrWS8LNrfHYwechtt,Sunroof,Sunroof,Nicky Youre;hey daisy,11/26/2021,163025,3,False,nick170708!,2022-07-15T04:18:52Z,,Thirty Knots,0.768,0.716,10,-5.11,1,0.0404,0.35,0.0,0.15,0.841,131.43,4,2022
spotify:track:4h9wh7iOZ0GGn8QVp4RAOB,I Ain't Worried,"I Aint Worried (Music From The Motion Picture ""Top Gun: Maverick"")",OneRepublic,5/13/2022,148485,82,False,nick170708!,2022-07-15T04:18:55Z,soft pop,Interscope Records,0.704,0.797,0,-5.927,1,0.0475,0.0826,0.000745,0.0546,0.825,139.994,4,2022
spotify:track:09gysnJpfQ3ublBmJDfcEC,SAD GIRLZ LUV MONEY Remix (feat. Kali Uchis and Moliy),SAD GIRLZ LUV MONEY Remix (feat. Kali Uchis and Moliy),Amaarae;Kali Uchis;MOLIY,9/16/2021,204763,76,True,nick170708!,2024-11-01T16:53:57Z,"alté,afrobeats,afro r&b",0207 Def Jam,0.87,0.523,1,-8.052,0,0.0602,0.433,2.07e-05,0.113,0.319,110.02,4,2022
spotify:track:1ri9ZUkBJVFUdgwzCnfcYs,MAMIII,MAMIII,Becky G;KAROL G,2/10/2022,226088,70,False,nick170708!,2022-03-28T20:49:31Z,"reggaeton,latin,urbano latino",Kemosabe Records/RCA Records,0.843,0.7,4,-3.563,0,0.0803,0.0934,0.0,0.14,0.899,93.991,4,2022
spotify:track:6mmPpaltUZK7xjNlBPQQ0p,Desesperados,VICE VERSA,Rauw Alejandro;Chencho Corleone,12/10/2021,224996,78,True,nick170708!,2022-03-28T20:49:36Z,"reggaeton,urbano latino,trap latino,latin",Sony Music Latin/Duars Entertainment,0.869,0.694,1,-3.35,0,0.0783,0.356,0.00125,0.0878,0.511,90.02,4,2022
spotify:track:4C6Uex2ILwJi9sZXRdmqXp,Super Freaky Girl,Super Freaky Girl,Nicki Minaj,8/12/2022,170977,68,True,nick170708!,2022-08-12T10:16:35Z,,Republic Records,0.95,0.891,2,-2.653,1,0.241,0.0645,1.77e-05,0.309,0.912,133.01,4,2022
spotify:track:2SLwbpExuoBDZBpjfefCtV,Out of Time,Dawn FM,The Weeknd,1/6/2022,214193,77,False,nick170708!,2022-01-16T05:46:03Z,,XO / Republic Records,0.65,0.76,0,-4.422,0,0.0446,0.255,0.0,0.339,0.838,93.057,4,2022
spotify:track:59CfNbkERJ3NoTXDvoURjj,Boyfriend,Boyfriend,Dove Cameron,2/11/2022,153000,72,True,nick170708!,2022-03-28T20:49:49Z,,Disruptor Records/Columbia,0.345,0.612,7,-6.543,0,0.0608,0.232,0.0,0.194,0.232,179.773,3,2022
spotify:track:0skYUMpS0AcbpjcGsAbRGj,Pink Venom,Pink Venom,BLACKPINK,8/19/2022,186964,65,False,nick170708!,2022-08-19T09:48:38Z,k-pop,YG Entertainment/Interscope Records,0.798,0.697,0,-7.139,1,0.0891,0.0202,0.0,0.259,0.745,90.031,4,2022
spotify:track:34ZAzO78a5DAVNrYIGWcPm,Shirt,Shirt,SZA,10/28/2022,181830,63,True,nick170708!,2022-10-28T09:42:23Z,r&b,Top Dawg Entertainment/RCA Records,0.824,0.453,3,-9.604,0,0.0968,0.146,0.0273,0.0896,0.552,119.959,4,2022
spotify:track:5IgjP7X4th6nMNDh4akUHb,Under The Influence,Indigo (Extended),Chris Brown,10/4/2019,184203,84,True,nick170708!,2023-01-07T01:54:25Z,r&b,Chris Brown Entertainment/RCA Records,0.755,0.562,9,-8.947,0,0.0355,0.0186,0.000231,0.18,0.368,116.931,4,2022
spotify:track:6zJejIfVYLgjud3lTk4DLB,SNAP,SNAP PACK,Rosa Linn,7/15/2022,179551,1,False,nick170708!,2022-10-26T21:04:49Z,,Columbia,0.565,0.636,0,-8.198,1,0.0638,0.107,9.9e-06,0.447,0.525,170.01,4,2022
spotify:track:2DB4DdfCFMw1iaR6JaR03a,Bam Bam (feat. Ed Sheeran),Familia,Camila Cabello;Ed Sheeran,4/7/2022,206070,69,False,nick170708!,2022-04-13T20:40:45Z,soft pop,Epic,0.756,0.697,8,-6.377,1,0.0401,0.182,0.0,0.333,0.956,94.996,4,2022
spotify:track:1O2pcBJGej0pmH2Y9XZMs6,Una Noche en Medellín,Una Noche en Medellín,Cris MJ,1/21/2022,153750,4,True,nick170708!,2022-08-10T16:46:04Z,"reggaeton chileno,chilean trap,chilean mambo,reggaeton",Nabru Records LLC,0.87,0.548,10,-5.253,0,0.077,0.0924,4.6e-05,0.0534,0.832,96.018,4,2022
spotify:track:7dSZ6zGTQx66c2GF91xCrb,PROVENZA,PROVENZA,KAROL G,4/22/2022,210200,72,False,nick170708!,2022-06-19T18:50:24Z,"reggaeton,latin,urbano latino",BICHOTA RECORDS / INTERSCOPE RECORDS / UNIVERSAL MUSIC LATINO,0.87,0.516,1,-8.006,1,0.0541,0.656,0.00823,0.11,0.53,111.005,4,2022
spotify:track:58HvfVOeJY7lUuCqF0m3ly,MIDDLE OF THE NIGHT,MIDDLE OF THE NIGHT,Elley Duhé,1/10/2020,184447,75,False,nick170708!,2022-05-05T02:50:08Z,,Not Fit For Society/RCA Records,0.41,0.611,4,-8.271,0,0.0467,0.0228,0.0,0.116,0.0899,185.727,3,2022
spotify:track:1r9xUipOqoNwggBpENDsvJ,Enemy (with JID) - from the series Arcane League of Legends,Enemy (with JID) [from the series Arcane League of Legends],Imagine Dragons;JID;Arcane;League of Legends,10/28/2021,173381,75,False,nick170708!,2022-01-16T05:45:31Z,,KIDinaKORNER/Interscope Records,0.728,0.783,11,-4.424,0,0.266,0.237,0.0,0.434,0.555,77.011,4,2022
spotify:track:28JBD8p18xNuOfyV7Cotdn,Massive,"Honestly, Nevermind",Drake,6/17/2022,336924,71,False,nick170708!,2022-06-24T17:06:55Z,rap,OVO,0.499,0.671,4,-6.774,0,0.0561,0.114,0.0169,0.148,0.0557,124.994,3,2022
spotify:track:2KukL7UlQ8TdvpaA7bY3ZJ,BREAK MY SOUL,BREAK MY SOUL,Beyoncé,6/21/2022,278281,60,False,nick170708!,2022-06-21T14:53:10Z,,Parkwood Entertainment/Columbia,0.687,0.887,1,-5.04,0,0.0826,0.0575,2.21e-06,0.27,0.853,114.941,4,2022
spotify:track:0O6u0VJ46W86TxN9wgyqDj,I Like You (A Happier Song) (with Doja Cat),Twelve Carat Toothache,Post Malone;Doja Cat,6/3/2022,192840,75,True,nick170708!,2022-06-03T17:10:00Z,,Mercury Records/Republic Records,0.733,0.67,5,-6.009,1,0.0751,0.121,0.0,0.121,0.472,100.964,4,2022
spotify:track:52xJxFP6TqMuO4Yt0eOkMz,We Don't Talk About Bruno,Encanto (Original Motion Picture Soundtrack),Carolina Gaitán - La Gaita;Mauro Castillo;Adassa;Rhenzy Feliz;Diane Guerrero;Stephanie Beatriz;Encanto - Cast,11/19/2021,216120,72,False,nick170708!,2022-01-16T05:45:39Z,,Walt Disney Records,0.577,0.45,0,-8.516,0,0.0834,0.357,0.0,0.111,0.83,205.863,4,2022
spotify:track:76YSWx6L6FNsuaP6GWBb8P,All For Us,Imagination & the Misfit Kid,Labrinth;Zendaya,11/21/2019,191710,71,False,nick170708!,2022-08-10T16:37:13Z,,Syco Music,0.46,0.66,3,-6.642,1,0.0652,0.0108,0.000139,0.34,0.18,141.722,4,2022
spotify:track:3uUuGVFu1V7jTQL60S1r8z,Where Are You Now,Where Are You Now,Lost Frequencies;Calum Scott,7/30/2021,148197,78,False,nick170708!,2023-08-21T00:40:14Z,"tropical house,soft pop",Epic Amsterdam,0.671,0.636,6,-8.117,0,0.103,0.515,0.000411,0.172,0.262,120.966,4,2022
spotify:track:38T0tPVZHcPZyhtOcCP7pF,STAR WALKIN' (League of Legends Worlds Anthem),STAR WALKIN' (League of Legends Worlds Anthem),Lil Nas X,9/22/2022,210575,71,True,nick170708!,2022-09-27T01:14:24Z,,Columbia,0.637,0.715,2,-4.971,0,0.0455,0.148,0.0,0.0892,0.308,141.872,4,2022
spotify:track:4ZtFanR9U6ndgddUvNcjcG,good 4 u,SOUR,Olivia Rodrigo,5/21/2021,178146,82,True,nick170708!,2022-04-13T20:41:47Z,,Olivia Rodrigo PS,0.563,0.664,9,-5.044,1,0.154,0.335,0.0,0.0849,0.688,166.928,4,2022
spotify:track:7mFj0LlWtEJaEigguaWqYh,Sweetest Pie,Sweetest Pie,Megan Thee Stallion;Dua Lipa,3/11/2022,201334,67,True,nick170708!,2022-03-28T20:50:35Z,pop,300 Entertainment,0.814,0.628,7,-7.178,1,0.221,0.167,0.0,0.101,0.677,123.977,4,2022
spotify:track:3k3NWokhRRkEPhCzPmV8TW,Ojitos Lindos,Un Verano Sin Ti,Bad Bunny;Bomba Estéreo,5/6/2022,258298,83,False,nick170708!,2022-08-10T17:50:07Z,"reggaeton,trap latino,urbano latino,latin,latin alternative,electrocumbia",Rimas Entertainment LLC,0.647,0.686,3,-5.745,0,0.0413,0.08,1.34e-06,0.528,0.268,79.928,4,2022
spotify:track:46IZ0fSY2mpAiktS3KOqds,Easy On Me,30,Adele,11/19/2021,224694,82,False,nick170708!,2022-01-16T05:44:40Z,soft pop,Columbia,0.604,0.366,5,-7.519,1,0.0282,0.578,0.0,0.133,0.13,141.981,4,2022
spotify:track:35ovElsgyAtQwYPYnZJECg,Lift Me Up - From Black Panther: Wakanda Forever - Music From and Inspired By,Lift Me Up (From Black Panther: Wakanda Forever - Music From and Inspired By),Rihanna,10/28/2022,196519,70,False,nick170708!,2022-10-28T09:42:07Z,,Black Panther 2 Rihanna Recordings,0.247,0.299,9,-6.083,1,0.0315,0.899,0.0,0.131,0.172,177.115,4,2022
spotify:track:1wtOxkiel43cVs0Yux5Q4h,Snow On The Beach (feat. Lana Del Rey),Midnights,Taylor Swift;Lana Del Rey,10/21/2022,256124,67,True,nick170708!,2022-10-22T16:50:46Z,,Taylor Swift,0.663,0.321,9,-13.527,1,0.0409,0.701,0.000598,0.107,0.153,110.021,4,2022
spotify:track:00Blm7zeNqgYLPtW6zg8cj,One Right Now (with The Weeknd),One Right Now,Post Malone;The Weeknd,11/5/2021,193506,67,True,nick170708!,2022-03-28T21:02:18Z,,Republic Records,0.687,0.781,1,-4.806,1,0.053,0.0361,0.0,0.0755,0.688,97.014,4,2022
spotify:track:3LtpKP5abr2qqjunvjlX5i,Doja,Doja,Central Cee,7/21/2022,97392,77,True,nick170708!,2023-01-08T18:40:25Z,"uk drill,drill,uk grime",Central Cee,0.911,0.573,6,-7.43,1,0.288,0.38,0.0,0.403,0.972,140.04,4,2022
spotify:track:6Uj1ctrBOjOas8xZXGqKk4,Woman,Planet Her,Doja Cat,6/25/2021,172626,84,True,nick170708!,2022-06-19T18:50:52Z,,Kemosabe Records/RCA Records,0.824,0.764,5,-4.175,0,0.0854,0.0888,0.00294,0.117,0.881,107.998,4,2022
spotify:track:2rurDawMfoKP4uHyb2kJBt,Te Felicito,Te Felicito,Shakira;Rauw Alejandro,4/21/2022,172235,70,False,nick170708!,2022-06-19T18:50:21Z,"latin pop,reggaeton,urbano latino,trap latino,latin",Sony Music Latin,0.695,0.636,5,-4.654,1,0.317,0.234,0.0,0.081,0.575,174.14,4,2022
spotify:track:0ARKW62l9uWIDYMZTUmJHF,Shut Down,BORN PINK,BLACKPINK,9/16/2022,175889,67,False,nick170708!,2022-09-16T05:05:39Z,k-pop,YG Entertainment/Interscope Records,0.814,0.704,0,-5.146,1,0.036,0.00291,0.0,0.182,0.621,110.056,3,2022
spotify:track:6Xom58OOXk2SoU711L2IXO,Moscow Mule,Un Verano Sin Ti,Bad Bunny,5/6/2022,245939,84,True,nick170708!,2022-05-06T16:23:47Z,"reggaeton,trap latino,urbano latino,latin",Rimas Entertainment LLC,0.804,0.674,5,-5.453,0,0.0333,0.294,1.18e-06,0.115,0.292,99.968,4,2022
spotify:track:5ww2BF9slyYgNOk37BlC4u,La Bachata,La Bachata,Manuel Turizo,5/26/2022,162637,78,False,nick170708!,2022-10-26T21:04:33Z,"reggaeton,pop urbano,latin,colombian pop",Sony Music Latin/La Industria,0.835,0.679,7,-5.329,0,0.0364,0.583,1.98e-06,0.218,0.85,124.98,4,2022
spotify:track:1oFAF1hdPOickyHgbuRjyX,Save Your Tears (Remix) (with Ariana Grande) - Bonus Track,After Hours (Deluxe),The Weeknd;Ariana Grande,3/20/2020,191013,85,False,nick170708!,2022-03-28T21:02:01Z,pop,XO / Republic Records,0.65,0.825,0,-4.645,1,0.0325,0.0215,2.44e-05,0.0936,0.593,118.091,4,2022
spotify:track:5PjdY0CKGZdEuoNab3yDmX,STAY (with Justin Bieber),F*CK LOVE 3: OVER YOU,The Kid LAROI;Justin Bieber,7/23/2021,141805,9,True,nick170708!,2022-01-16T05:44:44Z,,Columbia,0.591,0.764,1,-5.484,1,0.0483,0.0383,0.0,0.103,0.478,169.928,4,2022
spotify:track:3gXWe15nwrjfhjYQ5RqLx7,29,29,Demi Lovato,8/17/2022,163027,51,True,nick170708!,2022-08-19T09:48:27Z,,Demi Lovato LP4/Island,0.322,0.698,1,-3.812,0,0.0542,0.00507,0.0,0.249,0.288,183.963,4,2022
spotify:track:0U1W2LZVUX7qTm7dDpqxh6,When You're Gone,When You're Gone,Shawn Mendes,3/31/2022,172266,68,False,nick170708!,2022-04-13T20:38:32Z,,Shawn Mendes LP4-5 PS/ Island,0.603,0.691,5,-5.805,1,0.0372,0.0248,0.0,0.583,0.577,147.148,4,2022
spotify:track:6N1K5OVVCopBjGViHs2IvP,The Joker And The Queen (feat. Taylor Swift),The Joker And The Queen (feat. Taylor Swift),Ed Sheeran;Taylor Swift,2/11/2022,185422,62,False,nick170708!,2022-03-28T20:51:33Z,soft pop,Atlantic Records UK,0.528,0.309,0,-7.398,1,0.0329,0.924,2.1e-06,0.282,0.307,133.83,4,2022
spotify:track:6LtHYDgYHRCHoKK3snfr2w,Im Tired (with Zendaya) - Bonus Track,Im Tired (with Zendaya) - Bonus Track,Labrinth;Zendaya,2/28/2022,187943,63,False,nick170708!,2022-03-28T20:50:22Z,,Columbia,0.375,0.133,0,-10.624,0,0.0352,0.651,0.0,0.0695,0.192,131.721,4,2022
spotify:track:1vbn9fEyw1IYhqgZJdu9ZB,Falling Back,"Honestly, Nevermind",Drake,6/17/2022,266178,61,False,nick170708!,2022-06-17T04:12:01Z,rap,OVO,0.718,0.758,10,-8.29,1,0.0703,0.238,0.00653,0.11,0.349,118.989,4,2022
spotify:track:0sTlGEld0h8kIPZaKDYUf4,Notion,Notion,The Rare Occasions,12/2/2021,195120,84,False,nick170708!,2023-05-08T01:36:38Z,,Elektra (NEK),0.309,0.883,9,-3.825,1,0.0808,0.0673,0.00111,0.0849,0.312,159.488,4,2022
spotify:track:1BSMpVGWs3v5BZKnAQziAc,Light Switch,Light Switch,Charlie Puth,1/20/2022,185680,9,False,nick170708!,2022-01-23T15:43:28Z,"soft pop,pop",Atlantic Records,0.69,0.626,6,-5.693,1,0.306,0.105,0.000335,0.0881,0.912,184.009,4,2022
spotify:track:62Yo3FDddWY8ydu6PW2wyz,Nail Tech,Nail Tech,Jack Harlow,2/18/2022,206385,56,True,nick170708!,2022-03-28T20:50:27Z,,Generation Now/Atlantic,0.677,0.557,1,-8.409,1,0.0694,0.00508,8.36e-06,0.0984,0.1,150.127,4,2022
spotify:track:59nOXPmaKlBfGMDeOVGrIK,WAIT FOR U (feat. Drake & Tems),I NEVER LIKED YOU,Future;Drake;Tems,4/29/2022,189893,83,True,nick170708!,2022-05-05T02:49:47Z,"rap,afrobeats,afro r&b,alté,afrobeat",Epic/Freebandz,0.463,0.642,1,-4.474,1,0.34,0.314,0.0,0.0686,0.339,83.389,4,2022
spotify:track:2KdKh9vHbKW0tZLqtpxxI0,Honest (feat. Don Toliver),Honest,Justin Bieber;Don Toliver,4/29/2022,193322,59,True,nick170708!,2022-05-05T02:49:59Z,,Justin Bieber 2021 PS/ Def Jam,0.81,0.655,8,-6.779,0,0.0698,0.127,8.16e-05,0.105,0.809,150.002,4,2022
spotify:track:5S9Zs5g9lTWnLIboN1pdlU,Fingers Crossed,Fingers Crossed,Lauren Spencer Smith,1/5/2022,175344,0,False,nick170708!,2022-01-16T05:45:35Z,,Lauren Spencer-Smith,0.603,0.473,5,-7.23,1,0.0511,0.616,0.0,0.31,0.446,109.494,4,2022
spotify:track:3GYlZ7tbxLOxe6ewMNVTkw,TV,Guitar Songs,Billie Eilish,7/21/2022,281380,84,False,nick170708!,2022-07-22T04:23:45Z,,Darkroom/Interscope Records,0.412,0.236,4,-15.159,0,0.0379,0.83,0.00653,0.147,0.119,140.214,4,2022
spotify:track:0IuVhCflrQPMGRrOyoY5RW,she's all i wanna be,she's all i wanna be,Tate McRae,2/4/2022,206772,5,False,nick170708!,2022-03-28T21:02:04Z,,RCA Records Label,0.614,0.644,2,-5.372,0,0.0426,0.0134,7.07e-06,0.117,0.651,160.036,4,2022
spotify:track:2TktkzfozZifbQhXjT6I33,Evergreen (You Didnt Deserve Me At All),Ivory,Omar Apollo,4/8/2022,216680,76,False,nick170708!,2023-01-08T18:40:17Z,bedroom pop,Warner Records,0.697,0.336,9,-10.395,1,0.0424,0.598,0.00528,0.107,0.31,82.029,3,2022
spotify:track:10SRMwb9EuVS1K9rYsBfHQ,Yet To Come,Proof,BTS,6/10/2022,193593,73,False,nick170708!,2022-06-10T04:02:23Z,k-pop,BIGHIT MUSIC,0.559,0.885,1,-4.515,1,0.189,0.0432,0.0,0.333,0.683,172.029,4,2022
spotify:track:0hquQWY3xvYqN4qtiquniF,Vegas (From the Original Motion Picture Soundtrack ELVIS),Vegas (From the Original Motion Picture Soundtrack ELVIS),Doja Cat,5/6/2022,182906,72,True,nick170708!,2022-05-06T16:23:58Z,,Kemosabe Records/RCA Records,0.801,0.601,8,-7.574,0,0.255,0.0777,3.23e-05,0.145,0.74,159.969,4,2022
spotify:track:5MMW4CZsZiZt2iuqAXzzWC,The Heart Part 5,The Heart Part 5,Kendrick Lamar,5/8/2022,332228,53,True,nick170708!,2022-05-09T00:40:13Z,"hip hop,west coast hip hop",pgLang/Top Dawg Entertainment/Aftermath/Interscope Records,0.7,0.812,1,-8.128,0,0.297,0.183,0.0,0.0756,0.801,97.405,4,2022
spotify:track:1Hohk6AufHZOrrhMXZppax,ALIEN SUPERSTAR,RENAISSANCE,Beyoncé,7/29/2022,215459,67,True,nick170708!,2022-08-19T09:48:33Z,,Parkwood Entertainment/Columbia,0.545,0.641,10,-6.398,0,0.0998,0.00453,6.59e-05,0.171,0.464,121.892,4,2022
spotify:track:2KnLkZ3z7PO3kgVGHGqDpD,It'll Be Okay,It'll Be Okay,Shawn Mendes,12/1/2021,222800,72,False,nick170708!,2022-01-17T12:57:49Z,,Shawn Mendes LP4-5 PS/ Island,0.398,0.286,7,-11.881,1,0.033,0.616,0.000146,0.0912,0.0666,78.262,4,2022
spotify:track:4uUG5RXrOk84mYEfFvj3cK,I'm Good (Blue),I'm Good (Blue),David Guetta;Bebe Rexha,8/26/2022,175238,85,True,nick170708!,2022-09-03T18:19:37Z,edm,Parlophone UK,0.561,0.965,7,-3.673,0,0.0343,0.00383,7.07e-06,0.371,0.304,128.04,4,2022
spotify:track:72yP0DUlWPyH8P7IoxskwN,Hold Me Closer,Hold Me Closer,Elton John;Britney Spears,8/26/2022,202245,71,False,nick170708!,2022-09-16T05:05:45Z,pop,EMI,0.667,0.75,0,-4.602,1,0.0906,0.0746,0.000198,0.197,0.486,126.041,4,2022
spotify:track:0WtM2NBVQNNJLh6scP13H8,Calm Down (with Selena Gomez),Calm Down (with Selena Gomez),Rema;Selena Gomez,8/25/2022,239317,80,False,nick170708!,2022-09-28T02:48:43Z,"afrobeats,afrobeat,afropop,afropiano",Mavin Records / Jonzing World,0.801,0.806,11,-5.206,1,0.0381,0.382,0.000669,0.114,0.802,106.999,4,2022
spotify:track:0T5iIrXA4p5GsubkhuBIKV,Until I Found You,Until I Found You,Stephen Sanchez,9/1/2021,177720,78,False,nick170708!,2022-10-28T20:28:46Z,,Republic Records,0.539,0.508,10,-6.05,1,0.0288,0.727,0.0,0.174,0.227,101.358,3,2022
spotify:track:3rWDp9tBPQR9z6U5YyRSK4,Midnight Rain,Midnights,Taylor Swift,10/21/2022,174782,73,False,nick170708!,2022-11-28T15:06:34Z,,Taylor Swift,0.604,0.375,0,-11.637,1,0.0633,0.71,5.87e-05,0.116,0.203,137.651,4,2022
spotify:track:2g6tReTlM2Akp41g0HaeXN,Die Hard,Mr. Morale & The Big Steppers,Kendrick Lamar;Blxst;Amanda Reifer,5/13/2022,239026,75,True,nick170708!,2023-01-08T18:40:06Z,"hip hop,west coast hip hop",pgLang/Top Dawg Entertainment/Aftermath/Interscope Records,0.775,0.736,1,-8.072,0,0.247,0.319,0.00116,0.127,0.362,100.988,4,2022
spotify:track:4pi1G1x8tl9VfdD9bL3maT,Big Energy,777,Latto,3/25/2022,172540,64,True,nick170708!,2023-01-08T18:40:10Z,,Streamcut/RCA Records,0.937,0.793,11,-4.431,0,0.115,0.0453,0.0,0.341,0.794,106.022,4,2022
spotify:track:3XOalgusokruzA5ZBA2Qcb,pushin P (feat. Young Thug),DS4EVER,Gunna;Future;Young Thug,1/13/2022,136266,68,True,nick170708!,2023-01-08T18:40:32Z,"melodic rap,rap,trap",300 Entertainment,0.773,0.422,1,-4.572,0,0.187,0.00783,0.00693,0.129,0.488,77.502,1,2022
spotify:track:1r8ZCjfrQxoy2wVaBUbpwg,THOUSAND MILES,THOUSAND MILES,The Kid LAROI,4/22/2022,164781,65,True,nick170708!,2023-01-08T18:42:36Z,,Columbia,0.376,0.657,7,-4.658,1,0.0768,0.0858,0.0,0.0884,0.203,80.565,4,2022
spotify:track:1Qrg8KqiBpW07V7PNxwwwL,Kill Bill,SOS,SZA,12/8/2022,153946,82,False,nick170708!,2023-01-07T03:24:37Z,r&b,Top Dawg Entertainment/RCA Records,0.644,0.735,8,-5.747,1,0.0391,0.0521,0.144,0.161,0.418,88.98,4,2023
spotify:track:0yLdNVWF3Srea0uzk55zFn,Flowers,Flowers,Miley Cyrus,1/13/2023,200454,21,False,nick170708!,2023-01-13T00:30:56Z,,Columbia,0.707,0.681,0,-4.325,1,0.0668,0.0632,5.15e-06,0.0322,0.646,117.999,4,2023
spotify:track:7oDd86yk8itslrA9HRP2ki,Die For You - Remix,Die For You (Remix),The Weeknd;Ariana Grande,2/24/2023,232857,73,False,nick170708!,2023-02-24T10:14:07Z,pop,XO / Republic Records,0.531,0.525,1,-6.5,0,0.0671,0.232,0.0,0.441,0.502,66.9,4,2023
spotify:track:1BxfuPKGuaTgP7aM0Bbdwr,Cruel Summer,Lover,Taylor Swift,8/23/2019,178426,87,False,nick170708!,2023-06-30T10:17:30Z,,Taylor Swift,0.552,0.702,9,-5.707,1,0.157,0.117,2.06e-05,0.105,0.564,169.994,4,2023
spotify:track:3rUGC1vUpkDG9CZFHMur1t,greedy,greedy,Tate McRae,9/15/2023,131872,88,True,nick170708!,2023-09-16T15:01:05Z,,RCA Records Label,0.749,0.729,6,-3.19,0,0.0321,0.261,0.0,0.113,0.816,111.004,1,2023
spotify:track:6AQbmUe0Qwf5PZnt4HmTXv,Boy's a liar Pt. 2,Boy's a liar Pt. 2,PinkPantheress;Ice Spice,2/3/2023,131013,72,True,nick170708!,2023-02-10T10:04:06Z,bedroom pop,Warner Records,0.696,0.809,5,-8.254,1,0.05,0.252,0.000128,0.248,0.857,132.962,4,2023
spotify:track:2dHHgzDwk4BJdRwy9uXhTO,Creepin' (with The Weeknd & 21 Savage),HEROES & VILLAINS,Metro Boomin;The Weeknd;21 Savage,12/2/2022,221520,82,True,nick170708!,2023-01-07T03:24:44Z,,Republic Records,0.716,0.613,1,-6.018,0,0.0522,0.391,0.0,0.0813,0.157,97.914,4,2023
spotify:track:3k79jB4aGmMDUQzEwa46Rz,vampire,vampire,Olivia Rodrigo,6/30/2023,219724,5,True,nick170708!,2023-06-30T10:17:27Z,,Olivia Rodrigo PS,0.484,0.53,5,-5.82,1,0.054,0.148,0.0,0.283,0.319,136.874,4,2023
spotify:track:3vkCueOmm7xQDoJ17W1Pm3,My Love Mine All Mine,The Land Is Inhospitable and So Are We,Mitski,9/15/2023,137773,87,False,nick170708!,2023-11-26T19:40:18Z,,Dead Oceans,0.504,0.308,9,-14.958,1,0.0321,0.868,0.135,0.158,0.121,113.95,4,2023
spotify:track:1xK59OXxi2TAAAbmZK0kBL,Romantic Homicide,Romantic Homicide,d4vd,7/20/2022,132630,87,False,nick170708!,2023-11-29T20:58:23Z,,Darkroom/Interscope Records,0.571,0.544,6,-10.613,1,0.0299,0.453,0.00805,0.322,0.216,132.052,4,2023
spotify:track:7x9aauaA9cu6tyfpHnqDLo,Seven (feat. Latto),Seven (feat. Latto),Jung Kook;Latto,7/14/2023,184400,78,True,nick170708!,2023-07-20T23:14:17Z,k-pop,BIGHIT MUSIC,0.788,0.841,11,-3.955,1,0.0432,0.301,0.0,0.0772,0.904,124.986,4,2023
spotify:track:7FbrGaHYVDmfr7KoLIZnQ7,Cupid - Twin Ver.,The Beginning: Cupid,FIFTY FIFTY,2/24/2023,174253,6,False,nick170708!,2023-04-22T03:51:18Z,k-pop,WM Korea,0.783,0.592,11,-8.332,0,0.0331,0.435,4.15e-06,0.347,0.726,120.018,4,2023
spotify:track:7KA4W4McWYRpgf0fWsJZWB,See You Again (feat. Kali Uchis),Flower Boy,"Tyler, The Creator;Kali Uchis",7/21/2017,180386,89,True,nick170708!,2023-05-27T22:38:07Z,,Columbia,0.558,0.559,6,-9.222,1,0.0959,0.371,7.49e-06,0.109,0.62,78.558,4,2023
spotify:track:1odExI7RdWc4BT515LTAwj,Daylight,Daylight,David Kushner,4/14/2023,212953,17,False,nick170708!,2023-04-28T13:47:09Z,,"Miserable Music Group, LLC",0.508,0.43,2,-9.475,0,0.0335,0.83,0.000441,0.093,0.324,130.09,4,2023
spotify:track:5mjYQaktjmjcMKcUIcqz4s,Strangers,Strangers,Kenya Grace,9/1/2023,172964,76,False,nick170708!,2023-09-16T15:01:13Z,,Warner Records/Major Recordings,0.628,0.523,11,-8.307,0,0.0946,0.701,0.00274,0.219,0.416,169.982,4,2023
spotify:track:2i2gDpKKWjvnRTOZRhaPh2,Moonlight,Moonlight,Kali Uchis,2/24/2023,187557,74,False,nick170708!,2023-05-24T00:18:34Z,,Geffen Records,0.64,0.719,7,-6.452,0,0.0516,0.477,0.0,0.16,0.889,136.79,4,2023
spotify:track:5aIVCx5tnk0ntmdiinnYvw,Water,Water,Tyla,7/28/2023,200255,84,False,nick170708!,2023-10-20T10:14:48Z,afrobeats,FAX Records/Epic,0.673,0.722,3,-3.495,0,0.0755,0.0856,0.0,0.137,0.519,117.187,4,2023
spotify:track:4xhsWYTOGcal8zt0J161CU,Lovin On Me,Lovin On Me,Jack Harlow,11/10/2023,138411,78,True,nick170708!,2023-11-17T10:03:26Z,,Generation Now/Atlantic,0.943,0.558,2,-4.911,1,0.0568,0.0026,2.19e-06,0.0937,0.606,104.983,4,2023
spotify:track:2IGMVunIBsBLtEQyoI1Mu7,Paint The Town Red,Paint The Town Red,Doja Cat,8/4/2023,231750,78,True,nick170708!,2023-08-04T10:14:48Z,,Kemosabe Records/RCA Records,0.868,0.538,5,-8.603,1,0.174,0.269,3.34e-06,0.0901,0.732,99.968,4,2023
spotify:track:4nrPB8O7Y7wsOCJdgXkthe,"Shakira: Bzrp Music Sessions, Vol. 53/66","Shakira: Bzrp Music Sessions, Vol. 53/66",Bizarrap;Shakira,1/11/2023,214945,76,False,nick170708!,2023-01-13T13:25:10Z,"argentine trap,trap latino,urbano latino,latin pop",DALE PLAY Records,0.842,0.745,2,-4.231,0,0.0399,0.281,2.61e-05,0.118,0.53,122.06,4,2023
spotify:track:6dgUya35uo964z7GZXM07g,Nonsense,emails i can't send,Sabrina Carpenter,7/15/2022,163648,84,False,nick170708!,2023-01-22T14:27:49Z,pop,Island Records,0.74,0.697,8,-4.912,1,0.034,0.0268,0.0,0.224,0.732,138.992,4,2023
spotify:track:7KokYm8cMIXCsGVmUvKtqf,Karma,Midnights,Taylor Swift,10/21/2022,204852,75,True,nick170708!,2023-05-24T00:18:30Z,,Taylor Swift,0.64,0.619,8,-7.108,1,0.065,0.062,0.0,0.475,0.121,90.008,4,2023
spotify:track:6wsqVwoiVH2kde4k4KKAFU,I KNOW ?,UTOPIA,Travis Scott,7/28/2023,211582,80,True,nick170708!,2023-11-30T13:32:20Z,rap,Cactus Jack/Epic,0.927,0.619,5,-4.441,0,0.0539,0.0186,0.0,0.104,0.817,117.995,4,2023
spotify:track:4iZ4pt7kvcaH6Yo8UoZ4s2,Snooze,SOS,SZA,12/9/2022,201800,86,True,nick170708!,2024-02-28T02:57:06Z,r&b,Top Dawg Entertainment/RCA Records,0.559,0.551,5,-7.231,1,0.132,0.141,0.0,0.11,0.392,143.008,4,2023
spotify:track:78Sw5GDo6AlGwTwanjXbGh,Here With Me,Here With Me,d4vd,9/22/2022,242484,19,False,nick170708!,2023-02-23T18:23:59Z,,Darkroom/Interscope Records,0.574,0.469,4,-8.209,1,0.0254,0.534,9.21e-05,0.128,0.288,132.023,4,2023
spotify:track:6GGtHZgBycCgGBUhZo81xe,Say Yes To Heaven,Say Yes To Heaven,Lana Del Rey,5/19/2023,209156,85,False,nick170708!,2023-05-19T14:17:32Z,,Polydor Records,0.485,0.348,6,-11.576,0,0.0257,0.678,0.167,0.118,0.145,99.898,4,2023
spotify:track:6wf7Yu7cxBSPrRlWeSeK0Q,"What Was I Made For? [From The Motion Picture ""Barbie""]","What Was I Made For? [From The Motion Picture ""Barbie""]",Billie Eilish,7/13/2023,222369,85,False,nick170708!,2023-07-14T04:09:40Z,,Darkroom/Interscope Records,0.391,0.084,0,-17.843,1,0.0317,0.953,0.0,0.0983,0.111,79.449,4,2023
spotify:track:1Y3LN4zO1Edc2EluIoSPJN,Until I Found You (with Em Beihold) - Em Beihold Version,Until I Found You (Em Beihold Version),Stephen Sanchez;Em Beihold,4/22/2022,176440,78,False,nick170708!,2023-01-07T03:25:07Z,,Republic Records,0.551,0.55,10,-5.339,1,0.0286,0.777,0.0,0.202,0.342,101.19,3,2023
spotify:track:4KULAymBBJcPRpk1yO4dOG,I Remember Everything (feat. Kacey Musgraves),Zach Bryan,Zach Bryan;Kacey Musgraves,8/25/2023,227195,86,False,nick170708!,2023-09-01T15:22:06Z,"country,red dirt",Warner Records,0.429,0.453,0,-7.746,1,0.0459,0.554,2e-06,0.102,0.155,77.639,4,2023
spotify:track:59uQI0PADDKeE6UZDTJEe8,Last Night,3 Songs At A Time Sampler,Morgan Wallen,1/31/2023,163854,26,True,nick170708!,2023-03-31T09:43:24Z,country,Big Loud Records / Mercury Records / Republic Records,0.492,0.673,6,-5.431,1,0.0347,0.413,0.0,0.137,0.488,203.812,4,2023
spotify:track:3dnP0JxCgygwQH9Gm7q7nb,Ella Baila Sola,Ella Baila Sola,Eslabon Armado;Peso Pluma,3/16/2023,165671,76,False,nick170708!,2023-04-03T15:50:22Z,"corridos tumbados,sad sierre�o,corrido,sierre�o,m�sica mexicana,corridos b�licos,banda,electro corridos",DEL Records,0.668,0.758,5,-5.176,0,0.0332,0.483,1.89e-05,0.0837,0.834,147.989,3,2023
spotify:track:4uUG5RXrOk84mYEfFvj3cK,I'm Good (Blue),I'm Good (Blue),David Guetta;Bebe Rexha,8/26/2022,175238,85,True,nick170708!,2023-02-23T18:23:44Z,edm,Parlophone UK,0.561,0.965,7,-3.673,0,0.0343,0.00383,7.07e-06,0.371,0.304,128.04,4,2023
spotify:track:1bDbXMyjaUIooNwFE9wn0N,Rich Flex,Her Loss,Drake;21 Savage,11/4/2022,239359,76,True,nick170708!,2023-01-08T19:15:26Z,rap,OVO / Republic Records,0.549,0.518,4,-9.39,0,0.257,0.0517,1.21e-06,0.378,0.418,160.07,4,2023
spotify:track:6WzRpISELf3YglGAh7TXcG,Popular (with Playboi Carti & Madonna) - From The Idol Vol. 1 (Music from the HBO Original Series),Popular (Music from the HBO Original Series),The Weeknd;Playboi Carti;Madonna,6/2/2023,215466,83,True,nick170708!,2023-07-20T23:14:25Z,rage rap,XO / Republic Records,0.854,0.674,1,-6.23,1,0.184,0.0517,8.53e-05,0.509,0.848,99.022,4,2023
spotify:track:2FDTHlrBguDzQkp7PVj16Q,Sprinter,Sprinter,Dave;Central Cee,6/1/2023,229133,81,True,nick170708!,2023-11-30T14:39:33Z,"grime,uk grime,uk drill,drill",Neighbourhood / Live Yours,0.918,0.681,1,-4.705,1,0.201,0.263,0.0,0.0615,0.706,139.057,4,2023
spotify:track:4rXLjWdF2ZZpXCVTfWcshS,fukumean,a Gift & a Curse,Gunna,6/16/2023,125040,78,True,nick170708!,2023-07-20T23:13:38Z,melodic rap,300 Entertainment,0.847,0.622,1,-6.747,0,0.0903,0.119,0.0,0.285,0.22,130.001,4,2023
spotify:track:5ww2BF9slyYgNOk37BlC4u,La Bachata,La Bachata,Manuel Turizo,5/26/2022,162637,78,False,nick170708!,2023-01-07T03:24:57Z,"reggaeton,pop urbano,latin,colombian pop",Sony Music Latin/La Industria,0.835,0.679,7,-5.329,0,0.0364,0.583,1.98e-06,0.218,0.85,124.98,4,2023
spotify:track:5odlY52u43F5BjByhxg7wg,golden hour,this is what ____ feels like (Vol. 1-4),JVKE,9/23/2022,209259,80,False,nick170708!,2023-01-07T03:25:23Z,,JVKE,0.515,0.593,4,-4.801,1,0.0322,0.653,0.162,0.25,0.153,94.467,3,2023
spotify:track:0WtM2NBVQNNJLh6scP13H8,Calm Down (with Selena Gomez),Calm Down (with Selena Gomez),Rema;Selena Gomez,8/25/2022,239317,80,False,nick170708!,2023-01-07T03:25:14Z,"afrobeats,afrobeat,afropop,afropiano",Mavin Records / Jonzing World,0.801,0.806,11,-5.206,1,0.0381,0.382,0.000669,0.114,0.802,106.999,4,2023
spotify:track:2Zo1PcszsT9WQ0ANntJbID,Feather,emails i can�t send fwd:,Sabrina Carpenter,3/17/2023,185552,82,True,nick170708!,2023-11-29T10:57:55Z,pop,Island Records,0.791,0.694,6,-4.332,0,0.0335,0.0736,1.75e-06,0.0958,0.826,123.508,4,2023
spotify:track:2i8f4VnnBjy0yDqH2C452a,bad idea right?,bad idea right?,Olivia Rodrigo,8/11/2023,184783,2,True,nick170708!,2023-08-11T10:07:36Z,,Olivia Rodrigo PS,0.631,0.88,9,-3.545,1,0.0999,0.00174,4.52e-06,0.0639,0.808,129.994,4,2023
spotify:track:0DWdj2oZMBFSzRsi2Cvfzf,TQG,MA�ANA SER� BONITO,KAROL G;Shakira,2/24/2023,197933,81,True,nick170708!,2023-02-25T13:01:29Z,"reggaeton,latin,urbano latino,latin pop",BICHOTA RECORDS / INTERSCOPE RECORDS / UNIVERSAL MUSIC LATINO,0.587,0.647,4,-3.385,0,0.327,0.619,0.0,0.106,0.686,90.123,4,2023
spotify:track:4MjDJD8cW7iVeWInc2Bdyj,MONACO,nadie sabe lo que va a pasar ma�ana,Bad Bunny,10/13/2023,267194,81,True,nick170708!,2023-10-13T15:33:12Z,"reggaeton,trap latino,urbano latino,latin",Rimas Entertainment LLC,0.787,0.621,4,-5.009,0,0.068,0.15,0.000402,0.58,0.13,139.056,4,2023
spotify:track:2Hh3ETdQKrmSI3QS0hme7g,Too Many Nights (feat. Don Toliver & with Future),HEROES & VILLAINS,Metro Boomin;Future;Don Toliver,12/2/2022,199920,84,True,nick170708!,2024-08-03T02:19:04Z,rap,Republic Records,0.573,0.668,7,-4.356,0,0.0467,0.189,4.01e-05,0.109,0.145,87.973,4,2023
spotify:track:5WxVXxCMRnvxUKFq40ELwq,Escapism.,Escapism. (Sped Up),RAYE;070 Shake,11/25/2022,272373,1,True,nick170708!,2023-01-07T03:25:20Z,,Human Re Sources,0.538,0.742,2,-5.355,1,0.114,0.138,4.67e-05,0.0934,0.25,96.107,4,2023
spotify:track:1vYXt7VSjH9JIM5oRRo7vA,Dance The Night - From Barbie The Album,Dance The Night (From Barbie The Album),Dua Lipa,5/25/2023,176579,81,False,nick170708!,2023-05-26T09:44:35Z,pop,Atlantic Records,0.671,0.845,11,-4.93,0,0.048,0.0207,0.0,0.329,0.775,110.056,4,2023
spotify:track:5w40ZYhbBMAlHYNDaVJIUu,Chemical,Chemical,Post Malone,4/14/2023,184013,74,True,nick170708!,2023-11-30T02:29:11Z,,Mercury Records/Republic Records,0.49,0.88,2,-4.856,1,0.0435,0.00154,0.0,0.103,0.392,169.949,4,2023
spotify:track:1Iq8oo9XkmmvCQiGOfORiz,Is It Over Now? (Taylor's Version) (From The Vault),1989 (Taylor's Version),Taylor Swift,10/26/2023,229477,71,False,nick170708!,2023-10-30T00:12:43Z,,Taylor Swift,0.599,0.651,0,-7.343,1,0.035,0.0486,0.0,0.126,0.153,100.001,4,2023
spotify:track:7DswEZZthZ6piQpL25qGAM,On My Mama,JAGUAR II,Victoria Mon�t,8/25/2023,184258,63,True,nick170708!,2024-02-05T11:21:56Z,alternative r&b,Lovett Music/RCA Records,0.675,0.546,4,-7.716,0,0.0511,0.556,0.00441,0.167,0.607,77.415,4,2023
spotify:track:741UUVE2kuITl0c6zuqqbO,Barbie World (with Aqua) [From Barbie The Album],Barbie World (with Aqua) [From Barbie The Album],Nicki Minaj;Ice Spice;Aqua,6/23/2023,109750,69,True,nick170708!,2023-06-27T22:13:15Z,"europop,eurodance",Atlantic Records,0.77,0.58,0,-8.393,1,0.247,0.519,0.000127,0.233,0.753,144.072,4,2023
spotify:track:2UW7JaomAMuX9pZrjVpHAU,La Bebe - Remix,La Bebe (Remix),Yng Lvcas;Peso Pluma,3/17/2023,234352,78,True,nick170708!,2023-12-26T05:01:18Z,"reggaeton mexa,reggaeton,electro corridos,dembow belico,corrido,corridos tumbados,corridos b�licos,m�sica mexicana,sad sierre�o,banda",WM Mexico,0.812,0.479,2,-5.678,0,0.333,0.213,1.21e-06,0.0756,0.559,169.922,4,2023
spotify:track:5L3ecxQnQ9qTBmnLQiwf0C,K-POP,K-POP,Travis Scott;Bad Bunny;The Weeknd,7/21/2023,185220,68,True,nick170708!,2023-07-21T04:21:19Z,"rap,reggaeton,trap latino,urbano latino,latin",Cactus Jack/Epic,0.814,0.618,5,-5.614,0,0.0619,0.0386,3.34e-06,0.671,0.535,121.075,4,2023
spotify:track:7aqfrAY2p9BUSiupwk3svU,First Person Shooter (feat. J. Cole),For All The Dogs,Drake;J. Cole,10/6/2023,247444,73,True,nick170708!,2025-07-01T20:39:58Z,rap,OVO/Republic,0.475,0.655,11,-7.342,0,0.33,0.0306,0.0,0.375,0.245,163.997,4,2023
spotify:track:4OMJGnvZfDvsePyCwRGO7X,Houdini,Houdini,Dua Lipa,11/9/2023,185917,12,False,nick170708!,2023-11-10T01:09:56Z,pop,Warner Records,0.744,0.789,9,-4.876,0,0.059,0.0036,0.00144,0.0947,0.866,116.985,4,2023
spotify:track:2gyxAWHebV7xPYVxqoi86f,get him back!,GUTS,Olivia Rodrigo,9/8/2023,211141,75,True,nick170708!,2023-09-08T04:07:44Z,,Olivia Rodrigo PS,0.553,0.847,5,-5.736,1,0.187,0.0143,0.0,0.561,0.733,162.024,4,2023
spotify:track:0QHEIqNKsMoOY5urbzN48u,Made You Look,Takin' It Back,Meghan Trainor,10/21/2022,134256,74,False,nick170708!,2023-01-07T03:25:17Z,,Epic,0.834,0.522,10,-3.574,1,0.0703,0.34,1.59e-06,0.0783,0.854,145.035,4,2023
spotify:track:5sdQOyqq2IDhvmx2lHOpwd,Super Shy,NewJeans 'Super Shy',NewJeans,7/7/2023,154666,79,False,nick170708!,2023-07-20T23:13:42Z,k-pop,ADOR,0.776,0.817,5,-6.018,0,0.0748,0.18,3.44e-05,0.146,0.515,149.921,4,2023
spotify:track:1i9lZvlaDdWDPyXEE95aiq,TELEKINESIS (feat. SZA & Future),UTOPIA,Travis Scott;SZA;Future,7/28/2023,353754,77,True,nick170708!,2024-01-23T15:05:23Z,"rap,r&b",Cactus Jack/Epic,0.458,0.535,5,-4.854,0,0.0281,0.575,0.0,0.168,0.216,82.826,4,2023
spotify:track:5XeFesFbtLpXzIVDNQP22n,I Wanna Be Yours,AM,Arctic Monkeys,9/9/2013,183956,92,False,nick170708!,2023-12-26T05:02:20Z,"indie,garage rock",Domino Recording Co,0.464,0.417,0,-9.345,0,0.0256,0.136,0.022,0.0974,0.479,67.528,4,2023
spotify:track:5Y35SjAfXjjG0sFQ3KOxmm,Nobody Gets Me,SOS,SZA,12/9/2022,180853,84,True,nick170708!,2023-01-07T18:50:59Z,r&b,Top Dawg Entertainment/RCA Records,0.358,0.284,7,-8.285,1,0.0285,0.805,0.0,0.183,0.276,99.796,3,2023
spotify:track:4P9Q0GojKVXpRTJCaL3kyy,All Of The Girls You Loved Before,All Of The Girls You Loved Before,Taylor Swift,8/23/2019,221407,71,False,nick170708!,2023-03-18T13:49:49Z,,Taylor Swift,0.729,0.467,2,-9.682,1,0.0419,0.71,4.53e-05,0.129,0.401,96.042,3,2023
spotify:track:3iHzKA9HlXf5wsGdsrsnSA,Forget Me,Broken By Desire To Be Heavenly Sent,Lewis Capaldi,5/19/2023,203666,72,False,nick170708!,2024-01-23T15:20:30Z,soft pop,Vertigo Berlin,0.451,0.754,1,-3.749,0,0.0864,0.327,0.0,0.332,0.674,203.894,4,2023
spotify:track:6iF4RgIjDvDqyW13PezSj3,Single Soon,Single Soon,Selena Gomez,8/25/2023,171655,65,False,nick170708!,2023-08-25T14:18:34Z,,Interscope Records,0.61,0.571,2,-5.649,1,0.0782,0.00863,0.0,0.131,0.747,105.01,4,2023
spotify:track:4Dvkj6JhhA12EX05fT7y2e,As It Was,Harry's House,Harry Styles,5/20/2022,167303,88,False,nick170708!,2023-01-07T03:24:47Z,,Columbia,0.52,0.731,6,-5.338,0,0.0557,0.342,0.00101,0.311,0.662,173.93,4,2023
spotify:track:3Ua0m0YmEjrMi9XErKcNiR,Like Crazy,FACE,Jimin,3/24/2023,212241,74,False,nick170708!,2024-04-06T19:48:43Z,k-pop,BIGHIT MUSIC,0.629,0.733,7,-5.445,1,0.0419,0.0025,0.0,0.357,0.362,120.001,4,2023
spotify:track:0HD8mbiPjp3o94X3EaZp0o,exes,exes,Tate McRae,11/17/2023,159400,4,True,nick170708!,2023-11-17T10:03:51Z,,RCA Records Label,0.822,0.578,5,-6.542,0,0.0582,0.164,0.000252,0.11,0.627,136.966,4,2023
spotify:track:2KslE17cAJNHTsI2MI0jb2,Standing Next to You,GOLDEN,Jung Kook,11/3/2023,206019,82,False,nick170708!,2023-11-03T12:16:55Z,k-pop,BIGHIT MUSIC,0.711,0.809,2,-4.389,0,0.0955,0.0447,0.0,0.339,0.816,106.017,4,2023
spotify:track:3r8RuvgbX9s7ammBn07D3W,Ditto,Ditto,NewJeans,12/19/2022,185506,80,False,nick170708!,2023-01-07T03:25:10Z,k-pop,ADOR,0.814,0.641,6,-5.957,0,0.111,0.027,0.0,0.0993,0.183,133.854,4,2023
spotify:track:0Nfh4u0J4bajcyp5pzaWCx,Used To Be Young,Used To Be Young,Miley Cyrus,8/25/2023,191185,57,False,nick170708!,2023-08-25T14:18:45Z,,Columbia,0.626,0.63,4,-3.834,1,0.0377,0.582,0.0,0.13,0.421,147.029,4,2023
spotify:track:07bsRv0pcpbG4zJeLsUs1p,Eyes Closed,Eyes Closed,Ed Sheeran,3/24/2023,194848,3,False,nick170708!,2023-03-24T09:57:32Z,soft pop,Atlantic Records UK,0.777,0.526,2,-6.221,1,0.0645,0.302,0.0,0.105,0.389,107.071,4,2023
spotify:track:0V3wPSX9ygBnCm8psDIegu,Anti-Hero,Midnights,Taylor Swift,10/21/2022,200690,80,False,nick170708!,2023-01-07T03:25:00Z,,Taylor Swift,0.633,0.648,4,-6.645,1,0.062,0.121,2.62e-06,0.161,0.49,96.888,4,2023
spotify:track:56xHMIfQPoe0prrSi3BGhf,Can�t Catch Me Now - from The Hunger Games: The Ballad of Songbirds & Snakes,Can�t Catch Me Now (from The Hunger Games: The Ballad of Songbirds & Snakes),Olivia Rodrigo,11/3/2023,205483,73,False,nick170708!,2023-11-10T10:48:17Z,,Olivia Rodrigo,0.409,0.347,11,-8.159,0,0.0359,0.834,4.55e-06,0.121,0.199,141.332,4,2023
spotify:track:6pD0ufEQq0xdHSsRbg9LBK,un x100to,un x100to,Grupo Frontera;Bad Bunny,4/17/2023,194563,77,False,nick170708!,2023-04-22T03:51:11Z,"cumbia norte�a,banda,norte�o,m�sica mexicana,corrido,corridos tumbados,grupera,tejano,ranchera,corridos b�licos,reggaeton,trap latino,urbano latino,latin",Rimas Entertainment LLC.,0.569,0.724,6,-4.076,0,0.0474,0.228,0.0,0.27,0.562,83.118,4,2023
spotify:track:7ABLbnD53cQK00mhcaOUVG,LALA,LA VIDA ES UNA,Myke Towers,3/23/2023,197920,79,True,nick170708!,2023-07-20T23:14:34Z,"reggaeton,trap latino,urbano latino",WEA Latina,0.708,0.737,1,-4.045,1,0.0436,0.0739,0.00162,0.0955,0.607,91.986,4,2023
